,id,title,description,thumbnail,channelTitle,channelId,viewCount,likeCount,dislikeCount,commentCount
0,vzopTRZzh-Y,20 Amazing Science Experiments and Optical Illusions! Compilation,This video is a compilation of 20 awesome science experiments. 00:02 Flammable hand sanitizer 00:25 Coca Cola and Pool chlorine reaction 00:47 Traveling Flame 01:04 Animated Optical Illusions...,https://i.ytimg.com/vi/vzopTRZzh-Y/default.jpg,Home Science,UCJnlW_BAdjOYRcsQ0BsxZ1Q,7188617,70440,3088,2034
1,kQrAgWAzDlk,20 Amazing Hair Transformations - Easy Beautiful Hairstyles Tutorials 🌺 Best Hairstyles for Girls,20 Amazing Hair Transformations - Easy Beautiful Hairstyles Tutorials Best Hairstyles for Girls I really hope you enjoy it and don't forget to subscribe to this channel for the latest...,https://i.ytimg.com/vi/kQrAgWAzDlk/default.jpg,Perfect Life,UCWaiODr4_y9G7XRNOEQAV6Q,4726091,46335,2362,1745
2,jLOs6y8lapM,20 Amazing Things You Can Do at Home Compilation,VIDEO----------- How To Make a Garbage Collector Robot arm -https://www.youtube.com/watch?v=foveGw-sHUA&t=5s How to Make a Powerful Gun! -https://www.youtube.com/watch?v=oI1HHrRMY1w&t=1s...,https://i.ytimg.com/vi/jLOs6y8lapM/default.jpg,Mr SunY,UCpzYeWbOFwHztPgliIB8f_g,1854083,15653,1539,351
3,Ir3xWCIIdyY,20 AMAZING Life Hacks & Ideas You Need To Know!,20 Amazing life Hack at Home Compilation How To Make a Garbage Collector Robot arm -https://www.youtube.com/watch?v=foveGw-sHUA&t=5s How to Make a Powerful Gun! -https://www.youtube.com/watch?v=...,https://i.ytimg.com/vi/Ir3xWCIIdyY/default.jpg,Mr SunY,UCpzYeWbOFwHztPgliIB8f_g,203231,1439,193,75
4,t1P_Y5-ilYs,20 AMAZING Fire Tricks !!!,"In this video I will show you 20 amazing tricks with fire. 10 amazing tricks with fire. Also I will use balloons, fire balls and do a lot of experiments. Its not a video of hame diy inventions...",https://i.ytimg.com/vi/t1P_Y5-ilYs/default.jpg,Experiment at Home,UCmUuT-rYYah9FYSamCH1Ljw,618004,3831,259,202
5,vVoC_laYVZQ,20 Amazing Illusions - Hand ART [Compilation],Compilation of my 20 best optical Illusions on my hand ! I gathered my 20 most popular videos in the drawing on hand for you! Music: End Game by (Machinimasound) CC 3.0 free --------...,https://i.ytimg.com/vi/vVoC_laYVZQ/default.jpg,TutoDraw,UCwd8OIwvnT6CKGuIs0d0JDg,6979087,29337,1802,1739
6,zuHvltvcCAM,Top 20 Amazing Lipstick Tutorial Compilation 💄 July 2017 | Part 10 💄,"Beauty Channel ♥ Subscribe : https://goo.gl/eygpHb Copyright issues : Our purpose, when making COMPILATIONS, is NOT to steal other people's videos, If i have uploaded one of your...",https://i.ytimg.com/vi/zuHvltvcCAM/default.jpg,Makeup Artist,UCZrI7gRiGFHiSFKKGFo5VSg,2844982,10040,1532,889
7,7SF_ep-X19E,TOP 20 Amazing DIY Craft Project Ideas That are Easy to Make!,TOP 20 Amazing DIY Craft Project Ideas That are Easy to Make! Credit: Instagram: @ordani_diy https://www.instagram.com/ordani_diy/ YouTube: ORDANI DIY https://www.youtube.com/watch?v=RZiiI1MkUWA...,https://i.ytimg.com/vi/7SF_ep-X19E/default.jpg,"Everything TV - DIY, Makeup, Hairstyles, Nail Art",UCj3GGUUvTZX-B4VFqt5q_JA,896784,7628,575,195
8,9Xn8Bnj5WHY,20 Amazing Photos You Should See At Least Once,Pictures store not only our memories but also the whole world's history. Here are 20 wonderful shots: there were some truly fascinating things going on before we were here! Subscribe...,https://i.ytimg.com/vi/9Xn8Bnj5WHY/default.jpg,BRIGHT SIDE,UC4rlAVgAK0SGk-yTfe48Qpw,3836191,13184,2490,740
9,XVJ7Q9jeTVA,Top 20 Amazing Chocolate Cake Decorating Ideas & Cake Style 2017 - Yummy Oddly Satisfying Cake Video,Top 20 Amazing Chocolate Cake Decorating Ideas & Cake Style 2017 - Yummy Oddly Satisfying Cake Video For copyright matters please contact us at: minz.gstore@gmail.com Subscribe: https://goo.gl...,https://i.ytimg.com/vi/XVJ7Q9jeTVA/default.jpg,Easy Cakes Decorating Ideas,UC7eB_MtuXDVB0PfIGIs_a0Q,750729,3784,363,220
10,b0HBzrB8ock,Top 20 Amazing Science Experiments incridible and fun Experiments compilation ! new 2017,Thanks for watching. amazing science experiments with everyday materials 20 Awesome Science Experiments You Can Do Right Now At Home ... 10 science experiments to do at home 100 Amazing Science...,https://i.ytimg.com/vi/b0HBzrB8ock/default.jpg,FunnyPhisicLAB,UC3CDpBqeQKzJtcyhL4cRNOQ,83972,295,53,13
11,Ruw2QmkUjX4,"20  Amazing DIY Room Decor,, DIY Hacks, DIY Accessories 2017",Credit: instgram: @dicadaka https://www.instagram.com/dicadaka /https://www.instagram.com/ordani_diy/. Subscribe: Amazing Compilations https://www.youtu...,https://i.ytimg.com/vi/Ruw2QmkUjX4/default.jpg,Amazing Compilations,UCbMtqOoWsqsRzUQcJ4-OQgA,98171,1112,148,26
12,u3c7bII1UX4,Top 20 Amazing Cookies Art Decorating - Compilation & Cookies Style 2017 - Cookies Decorating Videos,Top 20 Amazing Cookies Art Decorating Compilation & Cookies Style 2017 - Cookies Decorating Videos For copyright matters please contact us at: minz.gstore@gmail.com Subscribe: https://goo.gl/q...,https://i.ytimg.com/vi/u3c7bII1UX4/default.jpg,Easy Cakes Decorating Ideas,UC7eB_MtuXDVB0PfIGIs_a0Q,1033563,6339,543,348
13,XcJ8be2mrso,Top 20 Amazing Birthday Cake Women Ideas - Cake Style 2017 - Oddly Satisfying Cake Decorating Videos,"For copyright matters please contact us at: minz.gstore@gmail.com Subscribe: https://goo.gl/qqOl7o My channel : Easy Cakes Decorating Ideas . Cakes Decorating Idea for all ages , Everyday...",https://i.ytimg.com/vi/XcJ8be2mrso/default.jpg,Easy Cakes Decorating Ideas,UC7eB_MtuXDVB0PfIGIs_a0Q,1550713,6959,863,401
14,wxZKnstDTaY,20 AMAZING CLOTHING HACKS YOU DIDN'T KNOW ABOUT,Subscribe to 5-Minute Crafts: https://www.goo.gl/8JVmuC For copyright matters please contact us at: welcome@brightside.me -----------------------------------------------------------------------...,https://i.ytimg.com/vi/wxZKnstDTaY/default.jpg,5-Minute Crafts,UC295-Dw_tDNtZXFeAPAW6Aw,426621,4143,374,258
15,qffhoRDKRo8,TOP 20 AMAZING FACTS IN TELUGU|UNKNOWN FACTS IN TELUGU|FACTS 4U| 20 ఆశ్చర్యం కలిగించే నిజాలు,20 AMAZING FACTS IN TELUGU|UN KNOWN FACTS IN TELUGU|FACTS 4U|మీకుతెలియని 20 ఆశ్చర్యం కలిగించే నిజాలు.. IMAGES & VIDEO...,https://i.ytimg.com/vi/qffhoRDKRo8/default.jpg,FACTS 4U,UChhV32gtX0bA6KXXWzBTs9w,130586,2192,88,113
16,OLRhJVH2mBA,20 AMAZING DIY SLIMES!!! Mixing CRAZY THINGS Into Clear Slime / Water Slime! Satisfying Slime ASMR,Click here to download Best Fiends for FREE!! ♥ http://download.BestFiends.com/VisitMinutia ♥ You will also get $5 worth of gold and diamonds! This video is sponsored by Best Fiends...,https://i.ytimg.com/vi/OLRhJVH2mBA/default.jpg,Maqaroon,UCO7iqpYcqmeRz0my_who9kQ,5553696,334313,10148,44244
17,AQDEXwJLdPg,Top 20 Amazing Birthday Cake Decorating Ideas - Oddly Satisfying Cake Decorating & Cake Style 2017,"For copyright matters please contact us at: minz.gstore@gmail.com Subscribe: https://goo.gl/qqOl7o My channel : Easy Cakes Decorating Ideas . Cakes Decorating Idea for all ages , Everyday...",https://i.ytimg.com/vi/AQDEXwJLdPg/default.jpg,Easy Cakes Decorating Ideas,UC7eB_MtuXDVB0PfIGIs_a0Q,2733642,22423,1702,1525
18,eqq3PIYBFLg,New Haircut and Color Transformation 💖💗💟 Top 20 Amazing Hairstyles Compilation 2017,"New Haircut and Color Transformation Top 20 Amazing Hairstyles Compilation 2017 A hairstyle, hairdo, or haircut refers to the styling of hair, usually on the human scalp. Sometimes,...",https://i.ytimg.com/vi/eqq3PIYBFLg/default.jpg,BeautyPalace,UCPo4Ps1btpd1xFkNd5mrV2Q,6826509,45617,4852,3755
19,s6Og9FDcUqQ,Top 20 Amazing Chocolate Cake Decorating #7 - Oddly Satisfying Cake Decorating & Cake Style 2017,Top 20 Amazing Chocolate Cake Decorating #7 - Oddly Satisfying Cake Decorating & Cake Style 2017 For copyright matters please contact us at: minz.gstore@gmail.com Subscribe: https://goo.gl/qqO...,https://i.ytimg.com/vi/s6Og9FDcUqQ/default.jpg,Easy Cakes Decorating Ideas,UC7eB_MtuXDVB0PfIGIs_a0Q,325123,2040,148,80
20,DT3e6IpnH4Q,How To Make Chocolate Cake Video 2018 - 20 Amazing Chocolate Cake Decorating Ideas Compilation 2018,How To Make Chocolate Cake Video 2018 - 20 Amazing Chocolate Cake Decorating Ideas Compilation 2018 Subscribe: http://bit.ly/Mr-Cake Contact: mrcake102@gmail.com Do you love cakes?...,https://i.ytimg.com/vi/DT3e6IpnH4Q/default.jpg,Mr.Cakes,UCcGX3A7lSVGubdk4Fq89RFQ,82878,1105,61,70
21,2s6YqV28KDo,How To Make Chocolate Cakes! 20 Amazing Chocolate Cake Decorating Tutorials 2017,How To Make Chocolate Cakes! 20 Amazing Chocolate Cake Decorating Tutorials 2017 Subscribe: https://www.youtube.com/c/CakeJunkie Facebook: https://goo.gl/4xx0CI Do you love cakes?...,https://i.ytimg.com/vi/2s6YqV28KDo/default.jpg,CakeJunkie,UCTVkLchb5pUYvvnrSpPtpTw,1181622,10015,628,500
22,ultKgzEzUEs,Top 20 Amazing Hair Transformations - Beautiful Hairstyles Compilation,Welcome :) New videos everyday.. Top 20 Amazing Hair Transformations - Beautiful Hairstyles Compilation This video is for entertainment purposes only All videos belong to and are credited...,https://i.ytimg.com/vi/ultKgzEzUEs/default.jpg,Look Pretty,UCM424LXvCs1ngUfPkHqeINw,559683,3470,244,139
23,8cdkzc6V9TI,Top 20 Amazing Fruit Cake Decorating Compilation & Cake Style 2017 - Oddly Satisfying Cake Video,"For copyright matters please contact us at: minz.gstore@gmail.com Subscribe: https://goo.gl/qqOl7o My channel : Easy Cakes Decorating Ideas . Cakes Decorating Idea for all ages , Everyday...",https://i.ytimg.com/vi/8cdkzc6V9TI/default.jpg,Easy Cakes Decorating Ideas,UC7eB_MtuXDVB0PfIGIs_a0Q,399372,3319,207,149
24,Xmsth6qm3Vs,20 AMAZING FIRE TRICKS,Subscribe to 5-Minute Crafts: https://www.goo.gl/8JVmuC For copyright matters please contact us at: welcome@brightside.me -----------------------------------------------------------------------...,https://i.ytimg.com/vi/Xmsth6qm3Vs/default.jpg,5-Minute Crafts,UC295-Dw_tDNtZXFeAPAW6Aw,255151,2891,170,210
25,HBOnRgOmSmU,Top 20 Amazing Princess Cookies Art Decorating Ideas Cookies Style 2017 - Awesome Cookies Decorating,Video licenced By Tale Cookie Top 20 Amazing Princess Cookies Art Decorating Ideas Cookies Style 2017 - Awesome Cookies Decorating For copyright matters please contact us at: minz.gstore@gmail.com...,https://i.ytimg.com/vi/HBOnRgOmSmU/default.jpg,Easy Cakes Decorating Ideas,UC7eB_MtuXDVB0PfIGIs_a0Q,576342,2901,333,119
26,Wx_p-ubwvR4,Top 20 Amazing Cake Decorating - Chocolate Cake Decorating 2017 - Most Satisfying Cake Video 2017,Top 20 Amazing Cake Decorating - Chocolate Cake Decorating 2017 - Most Satisfying Cake Video 2017 Subscribe: http://bit.ly/cakejunkie Facebook: https://goo.gl/4xx0CI Do you love...,https://i.ytimg.com/vi/Wx_p-ubwvR4/default.jpg,CakeJunkie,UCTVkLchb5pUYvvnrSpPtpTw,452772,3021,224,97
27,9rmLICbES8I,20 Amazing DIY Craft Project Ideas That are Easy to Make!part 16,20 Amazing DIY Craft Project Ideas That are Easy to Make!(part 10) SUBSCRIBE to my channel for a new video every Week. Full Credit: All credit goes to its respective owners ! Music Credit:...,https://i.ytimg.com/vi/9rmLICbES8I/default.jpg,DIY Furious,UCjh8IzaCtrmwrtyKBpzFbVg,190943,1634,226,217
28,5uCYCkvisd4,Top 20 Amazing Cake Decorating Compilation - Cake Style 2017 - Oddly Satisfying Cake Decorating,"For copyright matters please contact us at: minz.gstore@gmail.com Subscribe: https://goo.gl/qqOl7o My channel : Easy Cakes Decorating Ideas . Cakes Decorating Idea for all ages , Everyday...",https://i.ytimg.com/vi/5uCYCkvisd4/default.jpg,Easy Cakes Decorating Ideas,UC7eB_MtuXDVB0PfIGIs_a0Q,265348,2108,126,105
29,uTdOD7R5y6c,TOP 20 AMAZING NON-COPYRIGHTED BEAT DROPS!!! (PART 2) - Killer Confidence,SONG LINKS: 20.https://youtu.be/j5DCb1ycXyA 19.https://youtu.be/PSew4kuoD7s 18.https://youtu.be/NLmqqimN_6M 17.https://youtu.be/STgM16LNsMk 16.https://youtu.be/2-LBkQef7yc 15.https://youtu.be/CPFtb...,https://i.ytimg.com/vi/uTdOD7R5y6c/default.jpg,Killer Confidence,UCt8FZvQlxhXRVNOWwr_0ZUQ,39927,2174,46,267
30,tvNJeOR7Pcs,Top 20 Amazing Cake Decorating and Designing ★ Best Cake Workers #6,Enjoy With Top 20 Amazing Cake Decorating Song: Kovan & Electro Light - Skyline [NCS Release] Music provided by NoCopyrightSounds. Download/Stream: http://ncs.io/SkylineYO Song: Elektronomi...,https://i.ytimg.com/vi/tvNJeOR7Pcs/default.jpg,عرفني,UCW55zuK3PV0DuLw_4u41w_Q,453479,3047,229,343
31,wVcP73kp0V8,Top 20 Amazing Cookies Art Decorating Ideas - Awesome Cookies Decorating - Cookies Style 2017,"For copyright matters please contact us at: minz.gstore@gmail.com Subscribe: https://goo.gl/qqOl7o My channel : Easy Cakes Decorating Ideas . Cakes Decorating Idea for all ages , Everyday...",https://i.ytimg.com/vi/wVcP73kp0V8/default.jpg,Easy Cakes Decorating Ideas,UC7eB_MtuXDVB0PfIGIs_a0Q,193372,1143,103,45
32,j_-vn-O77A8,"Top 20 "" Amazing Paradoxes "" Unbelievable Moments League of Legends","Top 20 "" Amazing Paradoxes "" Unbelievable Moments League of Legends(Pentakill lol, pro plays, outplays) ♥Credits thank for All ♥Tudo Nosso https://www.youtube.com/channel/UCRj_RQT7qSPqli9lb3-nk...",https://i.ytimg.com/vi/j_-vn-O77A8/default.jpg,Master,UCDegzZBq5aXV7x_Mn5c45bw,5262966,20602,4825,1775
33,BEPLsCKCflY,TOP 20 Amazing DIY Craft Project That are Easy to Make! #5,TOP 20 Amazing DIY Craft Project That are Easy to Make! SUBSCRIBE to my channel for a new video every Week. Full Credit: All credit goes to its respective owners ! Music Credit: @NoCopyrightSou...,https://i.ytimg.com/vi/BEPLsCKCflY/default.jpg,DIY Furious,UCjh8IzaCtrmwrtyKBpzFbVg,239359,1492,232,33
34,FYY3-6Uejtw,20 AMAZING DIYs YOU'LL WANT TO MAKE RIGHT NOW,Subscribe to 5-Minute Crafts KIDS: https://goo.gl/PEuLVt ---------------------------------------------------------------------------------------- Our Social Media: 5-Minute Crafts on YouTube:...,https://i.ytimg.com/vi/FYY3-6Uejtw/default.jpg,5-Minute Crafts KIDS,UC57XAjJ04TY8gNxOWf-Sy0Q,92987,860,34,42
35,cn7OYQ2iHhE,Top 20 Amazing Cookies Art Decorating Ideas - Cookies Style 2017 -  Awesome Cookies Decorating,"For copyright matters please contact us at: minz.gstore@gmail.com Subscribe: https://goo.gl/qqOl7o My channel : Easy Cakes Decorating Ideas . Cakes Decorating Idea for all ages , Everyday...",https://i.ytimg.com/vi/cn7OYQ2iHhE/default.jpg,Easy Cakes Decorating Ideas,UC7eB_MtuXDVB0PfIGIs_a0Q,334311,2900,144,185
36,mvKZFQrGhV4,"20 AMAZING FACTS IN TELUGU-6,UNKNOWN FACTS IN TELUGU-FACTS 4U-మీకుతెలియని ఆశ్చర్యపరిచే నిజాలు..","20 AMAZING FACTS IN TELUGU-6,UNKNOWN FACTS IN TELUGU-FACTS 4U-మీకుతెలియని ఆశ్చర్యపరిచే నిజాలు..   IMAGES & VIDEO SOURCE...",https://i.ytimg.com/vi/mvKZFQrGhV4/default.jpg,FACTS 4U,UChhV32gtX0bA6KXXWzBTs9w,65536,1483,64,153
37,pSQwccXrEdI,Top 20 Amazing Cookies Art Decorating Ideas Compilation - Awesome Cookies - Oddly satisfying video,Top 20 Amazing Cookies Art Decorating Ideas Compilation - Awesome Cookies - Oddly satisfying video https://youtu.be/pSQwccXrEdI Subscribe: https://goo.gl/iWVlwp Do you love cakes? Everyday...,https://i.ytimg.com/vi/pSQwccXrEdI/default.jpg,Awesome Cookie,UCNNTDa8upGwUzCjLhN76HFw,99621,722,49,36
38,gdsMsPzqDCw,Top 20 Amazing Cookies Art Decorating Ideas Compilation & Awesome Cookies - Cookies Decorating,Top 20 Amazing Cookies Art Decorating Ideas Compilation & Awesome Cookies - Cookies Decorating https://youtu.be/gdsMsPzqDCw Subscribe: https://goo.gl/iWVlwp Do you love cakes? Everyday...,https://i.ytimg.com/vi/gdsMsPzqDCw/default.jpg,Awesome Cookie,UCNNTDa8upGwUzCjLhN76HFw,53157,598,26,30
39,nXnRJFWHuFE,20 AMAZING FACTS IN TELUGU-7|UNKNOWN FACTS IN TELUGU|FACTS 4U|మీకు తెలియని 20 ఆశ్చర్యపరిచే నిజాలు,20 AMAZING FACTS IN TELUGU-7|UNKNOWN FACTS IN TELUGU|FACTS 4U|మీకు తెలియని 20 ఆశ్చర్యపరిచే నిజాలు..❤ ✅The village where boys...,https://i.ytimg.com/vi/nXnRJFWHuFE/default.jpg,FACTS 4U,UChhV32gtX0bA6KXXWzBTs9w,110444,1748,55,135
40,pU4WwsoC26A,Top 20 Amazing Hair Transformations - Beautiful Hairstyles Compilation 2017,"Top 20 Amazing Hair Transformations - Beautiful Hairstyles Compilation 2017 hairstyles for wedding guests, beautiful hairstyles for school, Easy Hair Style for Long Hair, Party Hairstyles,...",https://i.ytimg.com/vi/pU4WwsoC26A/default.jpg,Amazing Hairstyles,UC5SJWi-Yu9hu7EVsuuAAASA,117263,690,44,8
41,SQeYQek0Jgk,😀 TOP 20 AMAZING INTRO 😀  | MINECRAFT INTRO ANIMATIONS (SORRY FOR LATE 😅)(100 LIKES ?)🔔,Open me♢ . . . . ━━━━━━━━━━━━━━━━━━━━━━━━━━━━━━━━━━━━━━━━━━━━━━━━━ ☆ Thank for watching...,https://i.ytimg.com/vi/SQeYQek0Jgk/default.jpg,Good Intro,UC6n8yXaRcLkJ4vtLLqbznRA,94310,2306,117,256
42,v1azvGLWQmU,Top 20 Amazing Birthday Cake Decorating Ideas - Cake Style 2017 - Oddly Satisfying Cake Decorating,Top 20 Amazing Birthday Cake Decorating Ideas - Cake Style 2017 - Oddly Satisfying Cake Decorating https://youtu.be/v1azvGLWQmU Subscribe : https://goo.gl/LikiQr Do you love cakes? Everyday...,https://i.ytimg.com/vi/v1azvGLWQmU/default.jpg,DH Cake,UC91kgpSIrbrLkwwgNKgfdBQ,2759905,17168,1460,879
43,1jDpBl3TktE,New Hair Color Transformations  - Top 20 Amazing Hairstyles Compilation 2017,"New Hair Color Transformations - Top 20 Amazing Hairstyles Compilation 2017 For copyright issues, please contact: lifebeautytv@gmail.com Everyday we show you the best DIY Ideas like...",https://i.ytimg.com/vi/1jDpBl3TktE/default.jpg,LifeBeauty,UCZ-C3MumgpIahFQfUdwC6Ig,19605,477,14,31
44,Y4OzHmBFxKM,Top 20 Amazing PS4 Games of 2017,"The 20 BEST Playstation 4 Video Games of 2017 You Can Play Right Now: Persona 5, Horizon Zero Dawn, Assassin's Creed: Origins, Uncharted: The Lost Legacy, Nier: Automata etc. Playlist: 00:01...",https://i.ytimg.com/vi/Y4OzHmBFxKM/default.jpg,GAMEOST,UCbDuARPGsQJBG8dELL-37zw,8925,75,6,1
45,1QzTnilQLSo,20 Amazing Goals vs Atletico Madrid | Insane Derby Goals 🔥,Turn Notifications on and you will never miss a video again❗ Follow us:   Twitter: https://twitter.com/MadridistaTV1 Facebook: https://www.facebook.com/MadridistaTV1 ❌YouTube:...,https://i.ytimg.com/vi/1QzTnilQLSo/default.jpg,MadridistaTV,UCexoonWpGA1nwQctHsDv7ZQ,49029,1872,22,92
46,88o3gKkhYcU,"DIY Clothes Life Hacks! 20 Amazing DIY Project Ideas for Girls, DIY Crafts, DIY Room Decor","DIY Clothes Life Hacks! 20 Amazing DIY Project Ideas for Girls, DIY Crafts, DIY Room Decor Lipstick Tutorial Compilation 2017 New Amazing Lip Art Ideas September 2017 | Part 22 Subscribe:...",https://i.ytimg.com/vi/88o3gKkhYcU/default.jpg,LifeBeauty,UCZ-C3MumgpIahFQfUdwC6Ig,185568,1434,99,26
47,ZX8ZIkvABpI,Top 20 Amazing Cake Decorating Ideas Compilation - Chocolate Cake | Oddly Satisfying Cake Video,"For copyright matters please contact us at: minz.gstore@gmail.com Subscribe: https://goo.gl/qqOl7o My channel : Easy Cakes Decorating Ideas . Cakes Decorating Idea for all ages , Everyday...",https://i.ytimg.com/vi/ZX8ZIkvABpI/default.jpg,Easy Cakes Decorating Ideas,UC7eB_MtuXDVB0PfIGIs_a0Q,75928,667,36,36
48,zQOrvKDLueE,Top 20 AMAZING Escapes - League of Legends,"Top 20 Amazing Escape Moments in League of Legends / LoL - Pro Player Escapes, 200 IQ Jukes and Dodge Plays. Please give this video a LIKE if you enjoyed :D SUBSCRIBE for more League...",https://i.ytimg.com/vi/zQOrvKDLueE/default.jpg,Protatomonster,UClh5azhOaKzdlThQFgoq-tw,97388,892,63,67
49,M3uvSKtkbdE,Top 20 AMAZING Steam  Powered Vehicles / Machines With Steam Engine [Videos],"Top 20 awesome videos of steam vehicles including steam car, steam tractor, steam train and more, all powered by steam engines. Thanks for watching! Here's our Facebook page: https://www.facebook....",https://i.ytimg.com/vi/M3uvSKtkbdE/default.jpg,MashupZone,UCCLFxVP-PFDk7yZj208aAgg,15555,120,16,20
