,id,title,description,thumbnail,channelTitle,channelId,viewCount,likeCount,dislikeCount,commentCount
0,2i4D7VN-nwM,7 AMAZING AND EASY DIYs ANYONE CAN MAKE,"Via Mr. Maker, don't forget to subscribe to his channel http://bit.ly/2uHYEyA Original videos by Mr. Maker: https://www.youtube.com/watch?v=5oV2sDGzLSc&list=PLDZrPQy_N3U113vy0XuunU9q4chwSG-so&inde...",https://i.ytimg.com/vi/2i4D7VN-nwM/default.jpg,5-Minute Crafts,UC295-Dw_tDNtZXFeAPAW6Aw,1556683,10228,1375,602
1,Z2cfkenGkqA,7 AMAZING LIFE HACKS FOR CRAFTING - Testing Viral Life Hacks!,SECOND CHANNEL: https://www.youtube.com/watch?v=ISVWJmhPHuE Hey everyone! Today I'm showing you 7 MUST-TRY LIFE HACKS FOR CRAFTING! I hope you all enjoy the video - Nim XO ♡ MY STORE...,https://i.ytimg.com/vi/Z2cfkenGkqA/default.jpg,Nim C,UCr8knzz5ua7wvmW-QHyzoIQ,1448047,33531,1224,2220
2,G0HD5dJvUZI,7 AMAZING COCA-COLA LIFE HACKS!,https://www.youtube.com/channel/UCEZT7lHkvy7KkN3C6TWZ7TQ Subscribe to Aredrine!!,https://i.ytimg.com/vi/G0HD5dJvUZI/default.jpg,MrGear,UCo6DJdltbIub80bLiyJRv3w,133066,2475,368,275
3,o35TFk-IULM,"Relaxing Music 24/7 with Amazing Nature Videos 💚 Sleep Music, Meditation Music, Study Music","Welcome to our NON-Stop relaxing music 24/7 live stream for meditation, study, sleep, yoga, reading, spa, featuring highly recommended nature videos with mostly peaceful sleep music. This relaxing...",https://i.ytimg.com/vi/o35TFk-IULM/default_live.jpg,LoungeV Films - Relaxing Music and Nature Sounds,UCyupwg56cb-DKlz8fg09Vbw,139394,1715,75,0
4,bXdI9iMgSvA,7 Amazing Science Experiments,Google+ https://plus.google.com/+MrGearOfficial ------------------------------,https://i.ytimg.com/vi/bXdI9iMgSvA/default.jpg,MrGear,UCo6DJdltbIub80bLiyJRv3w,3657342,27812,2944,2921
5,_kwrdk207jA,The Best Top 7 AMAZING Auditions | America's Got Talent 2017,"Watch Got Talent Global's TOP 7 Auditions on America's Got Talent 2017, including Golden Buzzers. Who was your favourite Audition this season on AGT? Let us know in the comments below.. Got...",https://i.ytimg.com/vi/_kwrdk207jA/default.jpg,Got Talent Global,UCe_Fx4EZAgKjDz0aQ_Y7hSA,755711,3960,194,296
6,zPG0K8591-k,Top 7 Amazing Hair Transformations - Beautiful Hairstyles Tutorials Compilation 2017 👏👏👏,Top 7 Amazing Hair Transformations - Beautiful Hairstyles Tutorials Compilation 2017 Subscribe for more videos: https://goo.gl/6GZWfh Amazing Chocolate Cake https://www.youtube.com/w...,https://i.ytimg.com/vi/zPG0K8591-k/default.jpg,"Cake, DIY, Makeup, Hairstyles, Nail Art - Topic",UCzBWiqz5FUesyxZ6KdaA82g,11268266,54923,5660,2231
7,x7tqfKtLN94,7 AMAZING DIYs FOR KIDS,Credit: https://www.instagram.com/stephaniablog /Subscribe: Amazing Compilations https://www.youtube.com/channel/UCbMt.. . Subscribe:https://www.youtube.com/channe lThe Beautiful World.,https://i.ytimg.com/vi/x7tqfKtLN94/default.jpg,Amazing Compilations,UCbMtqOoWsqsRzUQcJ4-OQgA,536465,6598,355,262
8,a7-zN-JFR48,அசாத்திய சக்திவாய்ந்த 7 உயிரினங்கள் | 7 amazing animals with real superpower |,அதீத சக்திவாய்ந்த 7 உயிரினங்கள் | 7 amazing animals with real superpower | beautiful animals with superpower Tamil | #Amazon animals |...,https://i.ytimg.com/vi/a7-zN-JFR48/default.jpg,Kollywood Talk,UCtrR2IF1yEnGz1nfQghRWgg,169588,1987,73,36
9,gcedDgB6uco,7 AMAZING LIFE HACKS!,https://youtu.be/DO2RkYj2M5A My NEW Channel Subscribe to Aredrine !!!,https://i.ytimg.com/vi/gcedDgB6uco/default.jpg,MrGear,UCo6DJdltbIub80bLiyJRv3w,119827,2732,364,267
10,UrKp_8uxakk,7 Amazing Inventions You Must See,7 Crazy New Inventions That Will BLOW Your MIND I recommend: 10 Things You Should Never Do On An Airplane https://www.youtube.com/watch?v=nqsw_RVo8-Y 5 Creepy Mutant Fish Caught On Camera https://w...,https://i.ytimg.com/vi/UrKp_8uxakk/default.jpg,Real Bizarre,UCwNEx3HyQ_wiCL9LNn3mTSw,113966,689,65,40
11,h8OSs-w98Fk,7 AMAZING GIFTS UNDER $10,Looking for an affordable gift that cost less than $10. Bingo! Today you'll discover 7 borderline awesome Christmas gift ideas that will stuff your stocking. This includes: A brand new invention...,https://i.ytimg.com/vi/h8OSs-w98Fk/default.jpg,The Future Is Now,UCqkHsQeqwuPV3UunvXdgjFQ,3320042,22012,2126,1105
12,YfKC1xARxgU,7 Amazing FUTURE VEHICLES,7 Future Busses & Trucks You Need To See Subscribe! : http://www.youtube.com/c/DODOultimate Social Media: Facebook: https://www.facebook.com/itisfunnytv/?ref=hl Twitter : https://twitter.com/DO...,https://i.ytimg.com/vi/YfKC1xARxgU/default.jpg,Dodo Ultimate,UC6K7RiB8-UXKak64PnWSMAQ,65360,202,31,9
13,leMTa5N-mu8,7 Amazing Life Hacks,Like and Subscribe!! Track: LarsM - Lovers [NCS Release] Music provided by NoCopyrightSounds. Watch: https://www.youtube.com/watch?v=q5mdZxtko0A Free Download/Stream:...,https://i.ytimg.com/vi/leMTa5N-mu8/default.jpg,Aredrine,UCEZT7lHkvy7KkN3C6TWZ7TQ,244704,650,193,66
14,usIjgovQcUA,How To Do 7 AMAZING Magic Tricks!,"How To Do Amazing Magic Tricks! In this episode of How To Magic, Evan Era from EvanEraTV shows How To Do 7 Amazing Magic Tricks! Easy magic tricks for kids, beginners, and all ages! Family-frien...",https://i.ytimg.com/vi/usIjgovQcUA/default.jpg,EvanEraTV,UCWZZowzfDwihJ8VbQ3H8ivw,578159,11776,487,7545
15,Kqinx3Ke37Q,7 Amazing Multi-Tools You Need to See,Thank you for your time & Support Please Share if You Liked it :) Comment below and let us know which one did you like? 7 Amazing Multi-Tools You Need to See Links: 01- autoXscape ...,https://i.ytimg.com/vi/Kqinx3Ke37Q/default.jpg,4Tech HD,UCCxFYpGoG647OaNyRmmWEBQ,275721,1147,168,18
16,9vSV_iVctKQ,Top 7 Amazing Hairstyles Tutorials Compilation 2017,Top 7 Amazing Hairstyles Tutorials Compilation 2017 - https://youtu.be/9vSV_iVctKQ The most beautiful Hairstyles Tutorials This week 2017 May! The Best and NEW Hairstyles Tutorials This week...,https://i.ytimg.com/vi/9vSV_iVctKQ/default.jpg,Nail Art and Hairstyles,UC_cyuceAQYeOI8txvIOYECg,162217,1171,103,29
17,w_LF_0haArE,7 Amazing 3 Wheeled Vehicles You Have To See,This video features 7 awesome 3 wheeled vehicles you have ever seen. Subscribe for more videos: http://bit.ly/2nFw0JF -Credits: carver one in elsass autumn 2016/2 -by Wa Rius https://www.youtube...,https://i.ytimg.com/vi/w_LF_0haArE/default.jpg,DIY Garage,UCoV2Qw0sL-ApYQ62k-88K1w,1116420,2908,459,97
18,2CRjK-6vwzs,7 Amazing Science Experiments - You Can Do At Home!,Subscribe: http://mmd.to/Subscribe.,https://i.ytimg.com/vi/2CRjK-6vwzs/default.jpg,MadeMyDay,UCqJRc-9J8rWTL9OZ7MZxegw,922060,12841,645,222
19,QAIhcAhHchE,Top 7 Amazing Homemade inventions. You will enjoy it.,Links to the full video 1 https://www.youtube.com/watch?v=PWOOMqpDE-I&index=8&list=PLELaHMG3ODtrAVYBWeTO3RYRSV1ClmpQ9 2 https://www.youtube.com/watch?v=hLzwe6ymAZQ&list=PLELaHMG3ODtrAVYBWeTO3RYRSV1...,https://i.ytimg.com/vi/QAIhcAhHchE/default.jpg,Mr Maker,UCKCM0r9Kop_F6FV_panSqxQ,93773,496,24,8
20,J3Y_41ct3Lc,7 Amazing DIY Craft Project Ideas That are Easy to Make!,7 Amazing DIY Craft Project Ideas That are Easy to Make! SUBSCRIBE to my channel for a new video every Week. Full Credit: All credit goes to its respective owners ! Music Credit: @NoCopyrightS...,https://i.ytimg.com/vi/J3Y_41ct3Lc/default.jpg,DIY Furious,UCjh8IzaCtrmwrtyKBpzFbVg,286598,2922,555,148
21,fBPdAcZs4nU,7 Amazing Deep Ocean Mysteries,"7 Amazing Deep Ocean Mysteries If you liked the video Thumbs up, share and subscribe : ) Subscribe - http://goo.gl/zkF8nT Facebook- https://www.facebook.com/IndexSe7en Tumblr- https://www.tumblr...",https://i.ytimg.com/vi/fBPdAcZs4nU/default.jpg,IndexSe7en,UCJrQNPr2tzF84XNMsE9AYig,45627,201,20,22
22,A6mu_iQPzyM,7 AMAZING FOOD LIFE HACKS WITH HEAT GUN!,Subscribe: http://www.youtube.com/c/MisterHacker Google: https://goo.gl/wK7DH9 Awesome food life hacks with 600 degree HEAT GUN Music: 1 - Light From The Sky (Instrumental Version) - Johan...,https://i.ytimg.com/vi/A6mu_iQPzyM/default.jpg,Mr. Hacker,UCQtjJDOYluum87LA4sI6xcg,198538,3036,986,291
23,hxuJgK_JCSQ,7 Amazing CNC Machines You Should Have,7 Awesome CNC Machines Every Maker Will Love Links to all the Gadgets shown in the Video [ Show More ] ~*~ Top 5 Best CNC Router You Can Buy In 2018 ~*~ 1.E3 CNC Router Engraver Kit http://am...,https://i.ytimg.com/vi/hxuJgK_JCSQ/default.jpg,Zip HD,UCkCuSXCy9PzV2XDl5dE1iPg,733789,4311,438,120
24,vyigOka3ySo,7 Amazing Places To Visit Before You Die,"7 Amazing Places To Visit Before You Die My bucket list is already pretty long but there's always room for more adventures, experiences, and amazing places to visit. The world is full of...",https://i.ytimg.com/vi/vyigOka3ySo/default.jpg,Did You Know ?,UCOaD4JxNYk29LHbHTOx3SQA,13732,201,12,19
25,1aL1bbvoRKE,7 Amazing WoodWorking Tools You Should Have,7 Best DIY WoodWorking tool for your next DIY project You must have ====================================================== Wolfcraft Woodworking Tools - www.wolfcraft.de/de/produkte 1. JigSaw...,https://i.ytimg.com/vi/1aL1bbvoRKE/default.jpg,EDWIN,UCoVJEtEK7y-L7nNc7DP5V_A,587339,2605,424,39
26,pGTlFDeo7VU,7 Amazing Apps for Android 🔥 Don't Miss,Dosto Aaj Maine apko top 7 best Android apps ke bare me bataya Hai jo aap apne mobile me Jarur install kre . Download link 1) Wallp https://play.google.com/store/apps/details?id=com.infinity.wal...,https://i.ytimg.com/vi/pGTlFDeo7VU/default.jpg,MOB TRICKS,UCjf_HvQs9wZVZP9WlbJRAnw,34809,754,82,65
27,a1yHOFJydog,7 amazing optical illusions,Quirkology book: https://quirkologyblog.wordpress.com/about/ Quirkology illusion set: https://quirkologyblog.wordpress.com/illusion-set/ Music: https://cameronwattmusic.wordpress.com.,https://i.ytimg.com/vi/a1yHOFJydog/default.jpg,Quirkology,UCvGMGQC8gNkd4gwxSbABIlw,475735,8625,173,714
28,6_KnueONYW4,7 Amazing Post-Apocalyptic Short Films,Subscribe For Future Videos: http://bit.ly/1gnvQD2 Check out the Films: 7) Among the Ruins - http://bit.ly/2yMYSFC 6) Elegy - http://bit.ly/2xZUIgS 5) The Rising - http://bit.ly/2y5xxB8...,https://i.ytimg.com/vi/6_KnueONYW4/default.jpg,Deburke321,UCMY-YDiVUWoP8vu9vPd1tOg,21376,673,16,41
29,Ftk0rorsLA8,7 Amazing Chemical Experiments you can make at home,"What will you get if you mix hydrogen peroxide and yeast? In today's tutorial we'll show how to make colorful volcanoes, aromatic bath bombs, table embellishments using available materials...",https://i.ytimg.com/vi/Ftk0rorsLA8/default.jpg,Troom Troom,UCWwqHwqLSrdWMgp5DZG5Dzg,1476605,12661,685,871
30,EFk2Exi0_nk,7 AMAZING KITCHEN GADGETS on Amazon (Under $30),"This video shows the top 7 coolest kitchen gadgets that you can buy on Amazon today for less than $20. Get ready for some futuristic cool gadgets, that can all be used in the kitchen. This...",https://i.ytimg.com/vi/EFk2Exi0_nk/default.jpg,Cool Gadgets,UCvY_LjSx3Yttjz44lNxbGIA,405114,1410,297,43
31,Jq3I0ZNcTg4,7 Amazing Backpacks You Need to See,Thank you for your time & Support Please Share if You Liked it :) 7 Amazing Backpacks You Need to See Comment below and let us know which one did you like? Links: 01- JOEY : http://www.kickstar...,https://i.ytimg.com/vi/Jq3I0ZNcTg4/default.jpg,4Tech HD,UCCxFYpGoG647OaNyRmmWEBQ,912871,4645,374,182
32,NzsStor0NuA,7 Amazing Secrets Airlines Don't Want You To Know,Pilots and flight Attendants have revealed all and let us in on a few secrets that Airlines don't really want us to know. *SUBSCRIBE* to see weekly List / Fact videos! https://goo.gl/vQRXAn...,https://i.ytimg.com/vi/NzsStor0NuA/default.jpg,WOWsoAmaze,UCeHpWkvxWxXHg7Hzrkif-IQ,2151577,8005,3277,883
33,XBT3lReWAU4,7 Amazing Android Apps Must Try! November 2017,"Here are 7 Amazing Android Apps of November 2017. These Apps are very useful & Interesting, By using these apps you can customize your phone like a pro user. Must Try this November Best Android...",https://i.ytimg.com/vi/XBT3lReWAU4/default.jpg,Digi Kousik,UC8rh3jawAXu6y3zOKkzJyQw,25557,678,71,148
34,uGgwlIPcl2E,7 Amazing Gift Ideas on AMAZON (Under $20),Grab some hot cocoa and saddle up for a brand spankin' new video of 7 Amazing Christmas Gift Ideas Under $20. This offering of innovative gadgetry proves that you don't have to spend bookoos...,https://i.ytimg.com/vi/uGgwlIPcl2E/default.jpg,The Future Is Now,UCqkHsQeqwuPV3UunvXdgjFQ,712301,5095,753,379
35,FpWnbGcEV6M,Top 7 Crazy Amazing SINGERS of America's Got Talent 2017,CLICK HERE to Learn How To Sing Tips To Improve Your Singing Voice ▻ http://MusicTalentNow.com/Learn-To-Sing ◅ ♥ Please Follow Me On Twitter ♥ http://bit.ly/Twitter_MusicTalentNow...,https://i.ytimg.com/vi/FpWnbGcEV6M/default.jpg,MusicTalentNow,UCDnEa2HC2eeT-cN3pAKnNTw,3593864,22927,1475,808
36,v1OKkAEaDDc,7 Amazing Wall Bed You MUST Have,7 Amazing Wall Bed You MUST Have 1. Homfort http://homfort.ca/ 2.Slumbershelves hidden bed/wall bed - from Spaceman - www.spaceman.com 3. OPLA - Wall Bed - Milano Smart Living - www.milanosmartl...,https://i.ytimg.com/vi/v1OKkAEaDDc/default.jpg,WoW Tech,UCCFKrWtIcdooAZLFDtdTkQg,43881,213,15,3
37,3F3O9lz0LEA,7 AMAZING Cheap Smartphone Gadgets!,"7 Simple, Cheap Gadgets that will completely change how you use your smartphone! They can be bought from a nearby store or online! Graphicstock: http://graphicstock.com/MrWhosetheBoss_0817...",https://i.ytimg.com/vi/3F3O9lz0LEA/default.jpg,Mrwhosetheboss,UCMiJRAwDNSNzuYeN2uWa0pA,834708,13411,717,1039
38,S3yofpHB_E4,7 AMAZING PETS [REPTILES] TO OWN! PROS VS CONS! SnakeBytesTV,"SnakeBytesTV is produced by BHB Reptiles, one of the world's largest snake breeding facilities, and is hosted by Brian Barczyk. New episodes every Wednesday! Follow me at:http://www.twitter.com/sna...",https://i.ytimg.com/vi/S3yofpHB_E4/default.jpg,AnimalBytesTV,UCCGLzU6yF7DBAIg0493j9ow,164041,3473,98,672
39,g11n1Vr068k,Top 7 Amazing Hairstyles Tutorials Compilation 2017,Top 7 Amazing Hairstyles Tutorials Compilation 2017 Credit: Instagram: @georgiykot https://www.instagram.com/georgiykot/. I really hope you enjoy...,https://i.ytimg.com/vi/g11n1Vr068k/default.jpg,"Everything TV - DIY, Makeup, Hairstyles, Nail Art",UCj3GGUUvTZX-B4VFqt5q_JA,245563,2160,99,75
40,kkfoo0PCJvs,7 Amazing Origami-Inspired Inventions,Scientists and engineers are taking folding into the future! Hosted by: Hank Green ---------- Support SciShow by becoming a patron on Patreon: https://www.patreon.com/scishow ---------- Dooblydoo...,https://i.ytimg.com/vi/kkfoo0PCJvs/default.jpg,SciShow,UCZYTClx2T1of7BRZ86-8fow,255698,8461,125,472
41,65dNeK57Z8A,7 Amazing New PS4 Games You've Never Heard Of!,"Our last video from PSX 2017! Nath and Hollie present 7 amazing games from the show that you've never heard of, with new gameplay for each title so you can see what the fuss is about... PlayStatio...",https://i.ytimg.com/vi/65dNeK57Z8A/default.jpg,PlayStation Access,UC6yzV_xgKn8r77FkcmZyMSg,70046,1960,93,217
42,uhRc7qrF2k4,7 Amazing Things I Wish I Knew In Assassin's Creed Origins (Tips and Tricks),Tips and Tricks For Playing Assassin's Creed Origins.,https://i.ytimg.com/vi/uhRc7qrF2k4/default.jpg,ACVideos,UCwsLXInOtJM01ZCslCeuWxQ,167118,2560,111,267
43,fC4HJzVNZ0k,7 Amazing Gadgets You Need to See,Thank you for your time & Support Please Share if You Liked it :) 7 Amazing Gadgets You Need to See Comment below and let us know which one did you like? Links: 01- Navdy : http://amzn.to/2qj...,https://i.ytimg.com/vi/fC4HJzVNZ0k/default.jpg,4Tech HD,UCCxFYpGoG647OaNyRmmWEBQ,360348,1332,257,50
44,qpjzoLErg88,7 Amazing Things Your Butt Can Do in South Park: The Fractured But Whole,"New South Park The Fractured But Whole gameplay! Having played through a good chunk of South Park The Fractured But Whole for release, we are very aware of just how many talents are hidden...",https://i.ytimg.com/vi/qpjzoLErg88/default.jpg,Eurogamer,UCciKycgzURdymx-GRSY2_dA,64756,822,53,86
45,M2-0zly1GmY,7 Amazing Animal Abilities That You Wish You Had,You won't believe what amazing abilities some animals possess. Thoughty2 reveals seven amazing party tricks from the animal kingdom. SUBSCRIBE - New Vids Mon & Thurs: http://bit.ly/thoughty2...,https://i.ytimg.com/vi/M2-0zly1GmY/default.jpg,Thoughty2,UCRlICXvO4XR4HMeEB9JjDlA,664283,15162,229,1889
46,vAdb-r52PP4,7 Amazing Innovative Keyboards You MUST SEE,7 Amazing Innovative Keyboards You MUST SEE 0:15 #1.Logitech Multi-Device Keyboard K480 : http://goo.gl/HLM2ot 1:13 #2.Phorm : http://www.getphorm.com/ 2:28 #3.Microsoft Universal Foldable...,https://i.ytimg.com/vi/vAdb-r52PP4/default.jpg,Amazing Tech,UCWErHBYItphgrudAmL7azdg,26050,208,21,18
47,6GudsnEja28,7 Amazing Survival Axes You NEED To Have,"7 Amazing Survival Axes You NEED To Have Looking for the latest survival axes and tactical gear to make your outdoor adventures much safer? In this video, you will find a selection of the...",https://i.ytimg.com/vi/6GudsnEja28/default.jpg,Zip HD,UCkCuSXCy9PzV2XDl5dE1iPg,265283,1624,211,132
48,JP41ftuzqqA,7 Amazing Magic Smoke Tricks!,"SHOP HERE - http://www.EvanEraTV.com In this episode of How To Magic, Evan Era from EvanEraTV shows how to do 7 Amazing Magic Smoke Tricks :) awesome magic tricks with dry ice smoke and much...",https://i.ytimg.com/vi/JP41ftuzqqA/default.jpg,EvanEraTV,UCWZZowzfDwihJ8VbQ3H8ivw,844722,19653,879,4853
