,id,title,description,thumbnail,channelTitle,channelId,viewCount,likeCount,dislikeCount,commentCount
0,HHxN7hmV4ww,How to Make Money Online with Binary Trading - $2000 in 5 minutes [Binary Strategy 2017],How to Make Money Online with Binary Trading - $2000 in 5 minutes -Binary Strategy 2017 FREE Trading on DEMO Account - http://binopts.com/binary-trading Binary Trading is basically “all-or-noth...,https://i.ytimg.com/vi/HHxN7hmV4ww/default.jpg,Imba Trader,UC5HIaOl8Oj8VE1TXy_v_FMA,127458,1040,153,394
1,4VmY1Q5bKBg,How to Make Money Online ~ Binary Options Trading Tutorial,Join today http://www.traderush.us/ for free! http://www.binaryaccess.com/ HOW BINARY OPTIONS WORK With binary options you can invest a small or large amount from $5 up to $15000 on a single...,https://i.ytimg.com/vi/4VmY1Q5bKBg/default.jpg,1ycs5,UCrSBnV5MyZlqr_YltfPOSkw,13412,72,6,110
2,9l4FoNOA8BE,"Earn Money Online Without Investment -  Trading Software A Guaranteed $4,385,62 Every Month!’",Click Here =▻ http://tinyurl.com/jn7zlnu ------------------------------------------------------------------- Earn Money Online Without Investment - Trading Software A...,https://i.ytimg.com/vi/9l4FoNOA8BE/default.jpg,Digital Marketing & Investment Trading,UCcjb-cHJyMBRDja5n904ZVQ,15143,13,3,10
3,6gXiYK4ww5g,New App Online Trading Earn Unlimited Paytm and Freecharge cash jaldi Loot lo||,Reffer code KCOXPWAA App link https://play.google.com/store/apps/details?id=com.onlinestock.trading Subscribe our channel for more new offer video and letest update 100% Free from...,https://i.ytimg.com/vi/6gXiYK4ww5g/default.jpg,Tehno Family,UCD_9cphD0gPT097jE35Sinw,490,19,7,14
4,MRnoT9-swTQ,⚡⚡ Make Money With Bitcoin: Day #4⚡⚡ Earn Free Bitcoin in Cryptocurrency Trading - PROVEN METHOD!,"Earn Free Bitcoin in Cryptocurrency Trading 2017 - Cryptocurrency Technical Analysis http://BossofBitcoin.com Topics Covered: free bitcoin,best crypto,investing,cryptocurrency,what is bitcoin,bitc...",https://i.ytimg.com/vi/MRnoT9-swTQ/default.jpg,Brandon Kelly Crypto Trader,UC-f5nPBEDyUBZz_jOPBwAfQ,4101,255,7,57
5,sojDHwLy7eo,How to Earn Money via Forex Trading without investment,"In this Lecture I will Teach you How to Earn Money via Forex Trading without investment , for more info visit http://forexustaad.com Thank you !",https://i.ytimg.com/vi/sojDHwLy7eo/default.jpg,ForexUstaad.com,UColKJfR46umR3KAnM0ggMKQ,25933,293,27,90
6,5aaOgaHpdc0,Free unlimited PAYTM CASH-Microcoin.biz | Earn daily paytm cash doing trading and mining microcoin👍,My new channel :- https://www.youtube.com/channel/UCmZlLK3mN5qKJuKx2ZoQ_Rg?sub_confirmation=1 Sponsor code :- 9504425318 Sponsor code :- 9504425318 Sponsor code :- 9504425318 *Join ₹...,https://i.ytimg.com/vi/5aaOgaHpdc0/default.jpg,Work With Dileep,UCy29WE7aVFu-9W5h0yI1CqQ,902,14,4,9
7,2JZMj7kIrCI,Start free cryptocurrency trading and earn free 0.005 BTC daily youtube in hindi,join link-http://1ink.cc/Bsx7 my website-http://1ink.cc/IBAy.,https://i.ytimg.com/vi/2JZMj7kIrCI/default.jpg,Money Guru AskVerma,UC2xOpz8OuO9KjDCrnlrQSuw,287,5,0,3
8,sZVO64YvNos,gold/silver(mcx commodity) online trading in pocket money & few minutes,9619748433 9930715011 WWW.SPEEDEARNING.IN FREE STOCK MARKET TRADING TIPS FREE NSE FUTURES & OPTION TRADING TIPS BEST STOCK MARKET ADVISORY IN INDIA BEST ONLINE TRADING TIPS -~-~~-~~~-~~-~-...,https://i.ytimg.com/vi/sZVO64YvNos/default.jpg,Pankaj Jain,UCmo_Y2q_BAJ30ZTg6Qhcytg,39208,261,27,44
9,VWDVHCXfKzM,"भारत की 4 बेहतरीन ट्रेडिंग मोबाइल एप्स, Best Mobile Trading Apps in India - 2017 (in Hindi)",इस वीडियो को देखिए और जानिए भारत की 4 सबसे बेहतरीन मोबाइल एप्स के बारे में....,https://i.ytimg.com/vi/VWDVHCXfKzM/default.jpg,A Digital Blogger,UCksVr8lIwOPd1UtJkE3mdJQ,231238,2088,294,78
10,WNhqiBUPL3Y,Online Trading App||How to earn free paytm cash in online Trading App||Telugu||,"Online Trading, Join this app and use my referral code 319KL https://play.google.com/store/apps/details?id=com.online.tra.",https://i.ytimg.com/vi/WNhqiBUPL3Y/default.jpg,TEC EXP,UC_xiu9EmOjqSOl-Sc7zFeIA,206,3,3,10
11,Ropprzb5kY8,Online Foreign Currency Trading: Earn Money While Surfing the Net,http://www.HistoryBegins.org - Alpari is one of the Forex brokers that offer online foreign currency trading or Forex trading on-the-spot to its customers. The company's primary goal is to...,https://i.ytimg.com/vi/Ropprzb5kY8/default.jpg,DomainFlippingX,UCs0-XXOnghQujlW_8CDIw7g,4730,32,1,12
12,wLx-QfcuJmQ,How to earn money by doing trading with cryptocurrency ? - Telugu,"In This Video I'm Telling About "" How to earn money by doing trading with cryptocurrency ? - Telugu "" - [ Binance ] Link To Join :- https://goo.gl/frvXh6 - [ Bitconnect ] Link To Join :- https://go...",https://i.ytimg.com/vi/wLx-QfcuJmQ/default.jpg,mana telugu tech,UCnxaRDS5GWa6ibJpUHFkeZw,2741,56,5,44
13,MaI8YhcwQOk,Crypto Currency Trading Introduced ! Earn 1 Btc Easily Every Month!,"Hello friends, Join Crypto Trading On : https://poloniex.com You Can Follow Me On Fb : https://www.facebook.com/sumit.kapoor.1291 I hope you all make good money by doing crypto currency...",https://i.ytimg.com/vi/MaI8YhcwQOk/default.jpg,Money Guru,UC_d3dOruc-Y0CNzoNRLPDzw,87071,2051,201,351
14,afQqN9ubDOk,FREE Trading Lesson: How to Trade Gold Stocks (and Silver Stocks) For Profit!,"Get access to these live trading videos with veteran trend trader, Jerry Robinson, every Tuesday and Friday morning... http://ftmdaily.com/pro In this archived video dated Feb. 9, 2016, Jerry...",https://i.ytimg.com/vi/afQqN9ubDOk/default.jpg,Follow the Money,UCEL6mJKnIwoC8TohEvcvSkw,13032,150,4,13
15,1Y6jWeweUqw,Google Trader Software Review 2017 - Is GoogleTrader Binary Options  Trading System Safe? - Youtube,"To Make Income Online. . . Get Your Free Crash Course By Clicking Here: http://superiorfuture.net/Crash/Course Hi Pete Here, OK guys... get the 100% REAL truth about Binary Options Trading...",https://i.ytimg.com/vi/1Y6jWeweUqw/default.jpg,Crypto Hacker,UCKri4AqTaefqq1NYz0p0zKQ,22842,75,13,34
16,n6yW7fXwAu0,HOW TO EARN MONEY IN STOCK MARKET,"How to Make Money in Stock Market Consistently [Hindi] In this video, I have explained all the basic essentials that beginners would like to know about trading in the stock market with the...",https://i.ytimg.com/vi/n6yW7fXwAu0/default.jpg,MAKEPROFITWITHUS.COM,UCo27bHgoHrS0pNinNWSAqdA,777,15,1,9
17,m7UOXkIESLM,Iq  option open account earn money online trading naaw king,income on pc par b use kar sakty ho ghar bath k thori se mant sa hazaroon kamoo bas thori manat karo Kamyabi Allah day ga Agar video achi lagi to subscribe lazmi karna Agar koi masla ho...,https://i.ytimg.com/vi/m7UOXkIESLM/default.jpg,Naaw King,UC7wX-rz-bAuX_IPODnLwImg,97,5,3,2
18,yC77A5BEKUg,How Much Money Do You Need to Start Trading for a Living?,"How Much Money Do You Need to Start Trading for a Living? ☆ SUMMARY ☆ When I look at this question, I see the answer in two parts: 1) what kind of lifestyle do you want? and 2) how much...",https://i.ytimg.com/vi/yC77A5BEKUg/default.jpg,Sasha Evdakov,UCANbiv7ZczMkNh67X2IYMrA,516562,4483,464,605
19,NHGegxBG8eM,"Earn 5,000 Rupees Daily Paytm Cash Using This App 2018 | HINDI",Earn 5000 Rupees Daily Paytm Cash Using This App 2018 | HINDI Download This New *Updated 100% App: https://drive.google.com/file/d/1RF7d-2fgRCCKtfvUop6zfvX3KEyEX7J-/view?usp=drivesdk earn...,https://i.ytimg.com/vi/NHGegxBG8eM/default.jpg,MBBS MD MS,UCZVwaK3oK6veff3LipVtmxw,3385,25,24,8
20,g4VdNa7y9KI,Options Trading For Beginners - How To Make Money Online with Binary Options - Working 2017,Options Trading For Beginners - How To Make Money Online with Binary Options - Working 2017 FREE Trading on DEMO Account - http://binopts.com/reversal-strategy I came into internet marketing...,https://i.ytimg.com/vi/g4VdNa7y9KI/default.jpg,Imba Trader,UC5HIaOl8Oj8VE1TXy_v_FMA,148874,1385,142,825
21,SfjNfEuqabw,This is How I Make Money Easily With Robinhood Free Stock Trading - Video Proof + Get a Free Stock,This is How I Make Money Easily With Robinhood Free Stock Trading - Video Proof + Get a Free Stock. Use This Link to Claim Your Free Stock Now: http://share.robinhood.com/garnetk Click The...,https://i.ytimg.com/vi/SfjNfEuqabw/default.jpg,streetcredstudio,UCWQNxN6-Ur_VJyBR1YRxbeQ,664,9,3,5
22,LciORpR2cMs,Cryptocurrency trading - How you Can Earn 34 Bitcoin - Trading on Alt coin -Hindi & urdu,Get Crypto Signal Join Here : https://t.me/joinchat/AAAAAEHzDkuyW82a10U2kg How you Can Earn 34 Bitcoin - Trading on Alt coin - cryptocurrency trading- Hindi & urdu : https://youtu.be/LciORpR2cMs....,https://i.ytimg.com/vi/LciORpR2cMs/default.jpg,Make Money Guru,UC6wdBdKsEPYgId3apl7QMog,11461,271,29,74
23,6Xdh2Xq3v8A,How to do Binary Options Trading | Earn Money Online | Binary Options Trading,How to Trade in Binary Options | Earn money With Binary Options Trading | Get paid for Binary Trades START HERE: http://goo.gl/N2kVz8 OR Here: http://goo.gl/YRHB4n Binary Options Trading...,https://i.ytimg.com/vi/6Xdh2Xq3v8A/default.jpg,Arthur Gilles,UCORvjx1O2uh2cGY_ZfWSWSw,2559,4,0,8
24,6cohYnYynsk,mcx free tips get 2000/- daily in crude MINI LOT mcx trading with very low risk,www.speedearning.com 9619748433 Best ncdex tips advisor in mumbai Mcx tips advisory services in Mumbai Best mcx tips for beginners Stock broker course in india Online stock market courses...,https://i.ytimg.com/vi/6cohYnYynsk/default.jpg,Pankaj Jain,UCmo_Y2q_BAJ30ZTg6Qhcytg,132610,601,61,81
25,8QDeIcMLRjc,Forex Live Trading - How To Make $1500 In No Time At All,"http://forextradersdaily.com/dailymentoring/ross2-2/ click here. Learn how to REALLY make money in the markets by watching Dustin Pass, one of the world's best Forex Traders. Begin by watching...",https://i.ytimg.com/vi/8QDeIcMLRjc/default.jpg,Forex Traders Daily,UCdGWPON5o7fXDNmyRl3NEAA,283634,878,132,326
26,vDCMZZvi3VM,"Earn $70,20 Real Money Using Automated Trading Website","FREE $100 Trading Strategy ▻ http://2by.us/system 1. Login to account 2. Deposit money into your broker (min. $250) 3. Click on Auto-Trade 4. Make at least $400 a day! Earn $70,20 Real...",https://i.ytimg.com/vi/vDCMZZvi3VM/default.jpg,David Wills,UCBI218NPXVBg9-XEVtBuhaA,421,31,0,0
27,sGXgfdfxPl8,Make Money Online with Binary Options - Get FREE trading Strategy,"Open FREE $100 Account: http://2by.us/system I've made quite a few thousands online and withdraw already, so it must be legitimate way to make money online. What is unique about binary options...",https://i.ytimg.com/vi/sGXgfdfxPl8/default.jpg,Investment Trading,UCgnz9TGwwRQOBBgtMqpi2Mg,1375,39,0,16
28,20fJAZiKh98,Truth about Forex Trading 1 - Hindi MUST WATCH,"http://www.facebook.com/TheForexGurukul http://www.ForexGurukul.com (Soon launching FREE FOREX TRADING VIDEO Course in HINDI for our Youtube Subscribers only, So LIKE and SUBSCRIBE :) ) Before...",https://i.ytimg.com/vi/20fJAZiKh98/default.jpg,MarketGurukul,UC6ZkHcW5QQubZ-Q6XYINE3Q,191184,2282,95,482
29,QP0WbGiShAE,Forex trading : daily earn 30 rupees paytm cash || 7 Level Income,"Hello Friends, Refer Code : 986349 Refer Code : 986349 App download link ⏩https://play.google.com/store/apps/details?id=fiveinone.forextrading 100% real app list, 1)Earn unlimited paytm...",https://i.ytimg.com/vi/QP0WbGiShAE/default.jpg,TecHniCal J.S,UCm_5g9rc9_vOpXGpgYNZrtA,183,18,2,2
30,JGUiDvZEU2s,HOW MUCH DO TRADERS EARN? (Trader Lifestyle),NOTE: The car in this video is rented and we aren't trying to suggest otherwise (I was on holiday!). I discuss it in a video here: https://www.youtube.com/watch?v=20-XNQHylqw There are stories...,https://i.ytimg.com/vi/JGUiDvZEU2s/default.jpg,The Duomo Initiative - Financial Education,UCHdE6HODo3UXD9E-QplAFOw,54412,413,55,68
31,eRMveVUMu1I,Make Money With Profitable Online Day Trading System For Beginners In Telugu,CLICK TO JOIN : Gntx : http://bit.ly/2hnDBMl Apexoriginal Link : http://apexoriginal.net Sponsor Id : 8639919046 ⬇ ⬇ ⬇ G ⬇ I ⬇ V ⬇ E ⬇ A ⬇ W⬇ A ⬇...,https://i.ytimg.com/vi/eRMveVUMu1I/default.jpg,Money World,UC97ZoLFOGLnZiB9Ut-o6NCg,3474,50,21,28
32,_jmw2wLUKmQ,Libertex Forex Trading Strategy - How To Make Money Online Fast 2017,Libertex ➤ http://www.7qop.com/c/10e6de367d47bc07?aff=_jmw2wLUKmQ Binary Option ➤https://www.youtube.com/watch?v=_jmw2wLUKmQ forex trading strategy - do you have a successful forex trading...,https://i.ytimg.com/vi/_jmw2wLUKmQ/default.jpg,Binary Option,UCSXyisWhsgciAbhEc4-FwxQ,29178,379,8,0
33,3X4ctpdqfi4,HOW TO MAKE THOUSANDS OF COINS WITHOUT TRADING IN FIFA 18! 😱,"FIFA 18 coins no trading? FIFA 18 best way to make coins? FIFA 18 free coins? • For cheap and reliable coins use ""LE5CHEAP"" at checkout [ad]: https://www.mulefactory.com/buy_fifa_18_coins/?campa...",https://i.ytimg.com/vi/3X4ctpdqfi4/default.jpg,LE96z,UC5aNohrM3xbOeIMWgl1yvdQ,48487,1232,98,316
34,RfUIIwt1kjU,BONUS $300 Start risk-free Forex trading NO DEPOSIT TIME TO MAKE REAL MONEY,Register now and get up to $300 on Bonus your real account Free link https://goo.gl/a3UBvC https://goo.gl/d9YRE5 https://goo.gl/Gqbx7A https://goo.gl/gy1GU2 http://1ink.cc/Cnjv Deposits/Withdrawal...,https://i.ytimg.com/vi/RfUIIwt1kjU/default.jpg,Bonus Forex Trading And autotrader,UCTNb9dPfRRpS615QWV9blwQ,789,4,0,0
35,Wk1XqXrnQmk,Free Forex Trading Course What is Forex in Urdu,"In this video i am going to start a free course on Forex Trading, Today our topic is what is Forex trading. In this video you will get a lot of information and knowledge about what is Forex....",https://i.ytimg.com/vi/Wk1XqXrnQmk/default.jpg,Online Taleem,UCZ_kB13RZwGV1p5AtuiVS9A,10541,186,16,5
36,oim7JpV8RTE,10 Secrets To Making Profit With CS:GO Trading,"Use the code 'GUIDES' and Recieve a free $0.50! https://csgoempire.com ☆ LINK TO THE 2x FACTORY NEW DRAGON LORES GIVEAWAY: https://ultr.ag/7 ☆ Since their introduction in mid 2013, Skins...",https://i.ytimg.com/vi/oim7JpV8RTE/default.jpg,Valve Guides,UCRr_0ZyHkDPpWky3uXlVZIA,190799,4783,325,396
37,PCG2DAYISoY,Become an Online Millionaire Trading Penny Stocks (How To Make Money Online From Home),Trading Course + LIFETIME Mentorship https://goo.gl/sz2i4K Become a millionaire online by trading penny stocks! Join My Chat Room!: https://goo.gl/MD6dw5 EQUITYFEED 2 WEEK TRIAL (NO CC REQUIRED):...,https://i.ytimg.com/vi/PCG2DAYISoY/default.jpg,Tony Ivanov,UCVTFjpy2ZJ4agDKKe4PRVpA,734,23,3,18
38,SsKt4wMey2Y,Earn Money With Vestly | Free Stock Trading App For Cash & Prizes,www.benificialmoney.ca.,https://i.ytimg.com/vi/SsKt4wMey2Y/default.jpg,BenificialMoney,UCBVkKYsnZflJIQp01rjji9Q,403,9,2,0
39,np0u1q7nOro,Beginner Guide to Investing  Forex Trading  Currency Trading - MAKE THOUSANDS,http://www.forextrendy.com/?hop=stevo1789 Click the link above to join the best trading system in Europe and America. Like The Forex Trendy Facebook page: https://www.facebook.com/Forex-Trendy-14...,https://i.ytimg.com/vi/np0u1q7nOro/default.jpg,Stephen T,UC2-1bZmMDPXW5wknAdzeRMw,594282,3536,216,808
40,P30bkhf5MAA,FIFA 18 Trading Tip #1 - Making Coins When You're Not Even Online (Lazy Buyers),"This method works great for me, I suggest you guys try it out! Thanks for the wicked support lately! LINKS: COMPARING PLAYERS: https://www.youtube.com/watch?v=HVDGBslcI6E When to sell players...",https://i.ytimg.com/vi/P30bkhf5MAA/default.jpg,Nick - FUT Trading,UC7Wyuc7HQXbC70GGqVLl9mQ,69480,1510,50,342
41,Nxvdm-qJxdI,"Bitcoin Basics (Part 5) - ""How To Make Money Trading Bitcoin""",Get Rocky's free Bitcoin course here - https://chrisdunn.com/free-bitcoin-course In this video I'm going to talk about my favorite subject - how to make money trading Bitcoin. As a professional...,https://i.ytimg.com/vi/Nxvdm-qJxdI/default.jpg,Chris Dunn,UCdC3h2m88FC02Yw-A_VESRQ,150327,1953,54,250
42,iJachHOgx88,How to make money from Bitcoin by trading Alt coins on Poloniex!,How to make money from Bitcoin by trading Alt coins on Poloniex! Bitcoin is going to completely change the financial markets. Start getting involved now so you don't miss your chance. The...,https://i.ytimg.com/vi/iJachHOgx88/default.jpg,John PI,UCC406kqHYzbHUTMCyM9VAfQ,5049,64,2,16
43,cgdnhPHgGbw,How to Make Money Fast Trading Crypto Coins on Poloniex,Join Hashflare. Start mining Bitcoin: https://hashflare.io/r/93DFD1A6 Join Genesis. Start mining Monero Get a 3% discount. Use promo code zM3Ejh https://www.genesis-mining.com/a/836035 Join...,https://i.ytimg.com/vi/cgdnhPHgGbw/default.jpg,ChampagneCrypto,UCOeDVSPVvPN_2b4Uq73DORQ,27262,203,20,37
44,YogettHDc4o,"How To Get Free Money Online Fast 💰  $50,000 TRader Step By Step Formula",CLICK HERE▻ http://clktr4ck.com/10Kdaily-plan ---------------------- How To Make Money Online Fast - Earn Money Online ($3000 per day) ************* MAKE MONEY ONLINE Starting now: http://clk...,https://i.ytimg.com/vi/YogettHDc4o/default.jpg,Make Money Online,UCApyH2ygtcs3zibtYGamzwQ,49,0,0,0
45,5qCoC5labn0,MY EXPERIENCE OF MAKING BIG MONEY FROM TRADING (The Honest Reality!),"Nicholas talks about the reality of his experiences of first making big money from trading (closing 5-figure and 6-figure trades). How it changed his life at the time, what he has learned as...",https://i.ytimg.com/vi/5qCoC5labn0/default.jpg,The Duomo Initiative - Financial Education,UCHdE6HODo3UXD9E-QplAFOw,89560,2930,112,641
46,SZOvE3ZMWLQ,What is Bitcoin?| How can you earn money through Bitcoin| BITCOIN Trading,What is Bitcoin?| How can you earn money through Bitcoin| BITCOIN Trading. For More Videos Visit: http://www.indiatvnews.com/video Facebook: www.fb.com/indiatvnews Twitter: www.twitter.com/indiatv...,https://i.ytimg.com/vi/SZOvE3ZMWLQ/default.jpg,IndiaTV,UCttspZesZIDEwwpVIgoZtWQ,1740,15,4,2
