,id,title,description,thumbnail,channelTitle,channelId,viewCount,likeCount,dislikeCount,commentCount
0,KGW5XNEVUv4,TOP 11 MAIORES JOGADORES DA EUROPA,"Chegou a hora de saber quem são os jogadores mais fodas que já passaram pela Europa! O Fred separou uma Seleção pra mostrá-los, posição por posição. Todos mitaram nos gramados europeus!...",https://i.ytimg.com/vi/KGW5XNEVUv4/default.jpg,Desimpedidos,UCFjrDmEnxrG5TRGVO0TPHLA,1267593,122236,2368,8003
1,c4VsF-8OIzE,TOP 11 FOOD LIFE HACKS,TOP 11 FOOD LIFE HACKS Subscribe now! https://www.youtube.com/c/amazingstuff2?sub_confirmation=1 More amazing stuff: https://www.youtube.com/watch?v=sSrXhylmIQc&list=PUJPfvoDyw7OA0Aaq2fzzWXw.,https://i.ytimg.com/vi/c4VsF-8OIzE/default.jpg,AmazingStuff,UCJPfvoDyw7OA0Aaq2fzzWXw,34338514,66173,27666,4149
2,Jnei1md-Ia0,11 Scariest Things Caught By Drones,TWITTER: http://bit.ly/ChillsTwitter INSTAGRAM: http://bit.ly/ChillsInstagram FACEBOOK: http://bit.ly/ChillsFacebook REDDIT: http://bit.ly/ChillsReddit Subscribe Here: http://bit.ly/ChillsYouTube...,https://i.ytimg.com/vi/Jnei1md-Ia0/default.jpg,Chills,UCN64HIrZNqFQYZ2BuyY-4zg,23421880,112066,75976,64768
3,RtjSIWxgqDo,"The Voice 2017 Chloe Kohanski - Top 11: ""Total Eclipse of the Heart""","Chloe Kohanski sings Bonnie Tyler's ""Total Eclipse of the Heart"" during the live Top 11 performances. » Get The Voice Official App: http://bit.ly/TheVoiceOfficialApp » Subscribe for More:...",https://i.ytimg.com/vi/RtjSIWxgqDo/default.jpg,The Voice,UCpdK1NLHxEUGXc1gq2NxkTw,2804767,38640,955,3996
4,c2Koa__7jMM,iOS 11 Hidden Features – Top 11 List,"Watch this video to see the best Hidden iOS 11 Features. Including over 11 Hidden Features, Tips, and Tricks in iOS 11! From the new Smart Invert Dark Mode, to turning on Emergency SOS and...",https://i.ytimg.com/vi/c2Koa__7jMM/default.jpg,AppFind,UCw185nSrRQ8kW1uFO4l0CFg,3508194,86255,3521,2243
5,OArACq2vEwY,MY DREAM TEAM by Zlatan Ibrahimovic,MY DREAM TEAM by Zlatan Ibrahimovic - Subscribe to the PSG official Youtube channel here: http://bit.ly/1zl9Xb6 PSG.TV asked Zlatan Ibrahimovic to select his best starting eleven: The team...,https://i.ytimg.com/vi/OArACq2vEwY/default.jpg,PSG - Paris Saint-Germain,UCt9a_qP9CqHCNwilf-iULag,10730446,104608,5223,5705
6,0Y_3igyDom4,Top 11 Worst Movie Sequels,"There's so many bad ones, but which sequels are hands down the worst of the worst? Nostalgia Critic gives you his picks for Top 11 Worst Movie Sequels. Support this weeks charity Brain & Behavior...",https://i.ytimg.com/vi/0Y_3igyDom4/default.jpg,Channel Awesome,UCiH828EtgQjTyNIMH6YiOSw,1177374,25650,912,9881
7,aelJEI-_dxs,Top High School QBs Compete in the Elite 11 Pro Day | NFL Network,In the second episode of Elite 11 the top high school quarterback's compete in the Elite 11 Pro Day. Watch new episodes of Elite 11 Tuesday's at 10:30pm EST on NFL Network. Subscribe to NFL...,https://i.ytimg.com/vi/aelJEI-_dxs/default.jpg,NFL Network,UC_1H9v258pXiyLDaW0R5exw,1377885,10345,306,607
8,pAvNqdFaYNY,Top 11 Famous Red Cards ● Impossible To Forget,"Title: Top 11 Famous Red Cards ○ Impossible To Forget Great deals of UP TO 80% OFF on over 9500 brand name fragrances, skincare and cosmetics including Cristiano Ronaldo Legacy. Use code:...",https://i.ytimg.com/vi/pAvNqdFaYNY/default.jpg,Wrzzer,UCr5vPy2YUScYtiyAYiGn2Rg,245016,4488,180,286
9,ZmFYASIKbnM,"Nepal Idol, Top 11, Full Episode 19, 14 July 2017",Format Created By Simon Fuller Based on format owned by Fremantle Media & 19TV Ltd. Consulting Producer Michelle Foreman Satish Datt Aradhana Bhola Project Head Suresh Paudel Post Production...,https://i.ytimg.com/vi/ZmFYASIKbnM/default.jpg,Nepal Idol,UCxwa4RK4FCq-1LR5l5Dh8vA,802737,6472,666,1937
10,gwID2ritcfE,TOP 11 LUXURY SUV TO BUY 2018,LIKE our Facebook Fan Page NOW https://www.facebook.com/Automoho FOLLOW US ON INSTAGRAM http://www.instagram.com/automoho Top 11 Luxury SUV 2018. These are 11 Luxury SUV worth buying for...,https://i.ytimg.com/vi/gwID2ritcfE/default.jpg,AutoMoHo,UC8GlTq1oHWVq0wEANn1IKuw,1118793,3574,794,270
11,11pMfMY4w4A,"The Voice 2017 Shi’Ann Jones - Top 11: ""Listen""","Shi'Ann Jones sings Beyoncé's ""Listen"" during the live Top 11 performances. » Get The Voice Official App: http://bit.ly/TheVoiceOfficialApp » Subscribe for More: http://bit.ly/TheVoiceSub...",https://i.ytimg.com/vi/11pMfMY4w4A/default.jpg,The Voice,UCpdK1NLHxEUGXc1gq2NxkTw,573384,8396,1191,1326
12,QNYGPkPKVOw,Top 11 giocatori più veloci del mondo,Iscrivetevi e lasciate tanti like.,https://i.ytimg.com/vi/QNYGPkPKVOw/default.jpg,Luca Monaci,UCWzU3No_BQEFBLwvW2cp1ow,1147823,11688,1601,1125
13,Y9cx9Pl-leI,Top O11CE #14,"Top O11CE, el resumen semanal de tu serie favorita. Las jugadas, las bromas, las pesadillas, las frases y todo eso que pasa alrededor del fútbol. Síguenos en Facebook: https://www.facebook.com/D...",https://i.ytimg.com/vi/Y9cx9Pl-leI/default.jpg,Disney XD LA,UCrQXnPc5QSr4Ibu4JhY5KlQ,347198,4370,134,202
14,mWX0g0kBjAQ,Top 11 Strangest Yet Best Couples - Nostalgia Critic,"This Valentine's Day, get a box of chocolates to the only one strange enough to stay with you! Originally aired on February 11th, 2014. Go to our Store for Awesome Stuff - https://theawesomestore...",https://i.ytimg.com/vi/mWX0g0kBjAQ/default.jpg,Channel Awesome,UCiH828EtgQjTyNIMH6YiOSw,300620,10976,158,1443
15,d1eHXGpqBEs,Top 11 Halloween Guilty Pleasures,"They're not great, they're not awful, so what is it that draws us to them, here are the Top 11 Halloween Guilty Pleasures. This week's charity is the Michael J Fox Foundation - http://bit.ly/1...",https://i.ytimg.com/vi/d1eHXGpqBEs/default.jpg,Channel Awesome,UCiH828EtgQjTyNIMH6YiOSw,758180,13418,252,4479
16,qyZacZPzOS8,Top 11 South Park Episodes - Nostalgia Critic,"Did your favorite make the list? Find out if it did in this Top 11 South Park episodes from the Nostalgia Critic. Originally aired on April 30th, 2013. Go to our Store for Awesome Stuff -...",https://i.ytimg.com/vi/qyZacZPzOS8/default.jpg,Channel Awesome,UCiH828EtgQjTyNIMH6YiOSw,841046,20576,559,3557
17,8x215N-EynA,Top O11CE #1,"Top O11CE #1 Top O11CE, el resumen semanal de tu serie favorita. Las jugadas, las bromas, las pesadillas, las frases y todo eso que pasa alrededor del fútbol. Síguenos en Facebook: https://www....",https://i.ytimg.com/vi/8x215N-EynA/default.jpg,Disney XD LA,UCrQXnPc5QSr4Ibu4JhY5KlQ,532695,4373,208,204
18,FlmnTvS1FlQ,Top 11 Disney Princess Conspiracies,Thought you knew everything about these animated ladies? Well here are 11 theories that will have you looking at them a whole new way! New charity shout out next week. Go to our Store for...,https://i.ytimg.com/vi/FlmnTvS1FlQ/default.jpg,Channel Awesome,UCiH828EtgQjTyNIMH6YiOSw,826507,20139,789,7506
19,L5vchMoxutc,Top 11 Young Dribblers 2016/2017,Visit www.paneecalcio.com to find out the best u-20 player in every country; The video is based on a personal opinion and include only players born in 1995 or then; Music: Axol x Alex Skrindo...,https://i.ytimg.com/vi/L5vchMoxutc/default.jpg,TalentsHunters,UCP7tcCftz_ypQ1PorB4YTDg,203982,1994,131,257
20,vPRSRiM9bcA,Top 11 Scariest Performances - Nostalgia Critic,"The Nostalgia Critic brings you his Top 11 Scariest Performances. Originally aired on October 12, 2010. See more at our Site: http://channelawesome.com Follow us on Twitter: http://twitter.com/ch...",https://i.ytimg.com/vi/vPRSRiM9bcA/default.jpg,Channel Awesome,UCiH828EtgQjTyNIMH6YiOSw,510954,7903,159,909
21,-8qwvDjsqsA,Top 11 Best Movie Sequels,"There's so many bad ones, but Nostalgia Critic takes a look at which sequels deserve the most credit as being the best! Donate to ActionAid USA here - https://www.actionaidusa.org/ Go to...",https://i.ytimg.com/vi/-8qwvDjsqsA/default.jpg,Channel Awesome,UCiH828EtgQjTyNIMH6YiOSw,1138380,27140,602,7113
22,cGwlKs44YbM,Top 11 Simpsons Episodes - Nostalgia Critic,"Now here's a list you know you can't stay away from. Join the Nostalgia Critic as he counts down the Top 11 Simpsons Episodes! Originally aired on June 5th, 2012. Go to our Store for Awesome...",https://i.ytimg.com/vi/cGwlKs44YbM/default.jpg,Channel Awesome,UCiH828EtgQjTyNIMH6YiOSw,504697,14006,254,2389
23,K_ZToyQYE2c,"TOP 11 dei ""VECCHI"" - Classe ed Esperienza","La TOP 11 dei calciatori più vecchi migliori, nati nel 1983 o prima, tenendo conto del loro stato di forma attuale. La scelta è personale, la tua come sarebbe stata? Qui trovi una lista...",https://i.ytimg.com/vi/K_ZToyQYE2c/default.jpg,CALCIO SHOW ⚽,UCcU7SNxEtm4RlTnv5Nd_AUw,252236,7143,124,526
24,vuAXQNmIvrU,Top 11 Coolest Movie Cliches - Nostalgia Critic,"The Nostalgia Critic gives you his Top 11 Coolest Movie Cliches Originally aired on June 22, 2010, See more at our Site: http://channelawesome.com Follow us on Twitter: http://twitter.com/channel...",https://i.ytimg.com/vi/vuAXQNmIvrU/default.jpg,Channel Awesome,UCiH828EtgQjTyNIMH6YiOSw,212218,3627,46,511
25,z5uf1bkQQ-s,Top 11 GOOD Things from the Star Wars Prequels,"Yes, there are actually 11. Originally aired on April 15th, 2014. Get some Nostalgia Critic T-Shirts here - http://shrsl.com/?~96c0 See more at our Site: http://channelawesome.com Follow us...",https://i.ytimg.com/vi/z5uf1bkQQ-s/default.jpg,Channel Awesome,UCiH828EtgQjTyNIMH6YiOSw,800885,16950,858,4887
26,dwDwnrtyVhs,Top 11 WTF Alternate Movie Endings,"Can you believe these were the endings to hit films? Nostalgia Critic takes a look at the strangest choices for how films wrapped up. Support this weeks charity, Best Friends - http://bestfriends....",https://i.ytimg.com/vi/dwDwnrtyVhs/default.jpg,Channel Awesome,UCiH828EtgQjTyNIMH6YiOSw,1034827,29127,736,5008
27,wJ0fG-6-k_c,"The Voice 2017 Noah Mac - Top 11: ""Electric Love""","Noah Mac sings BØRNS's ""Electric Love"" during the live Top 11 performances. » Get The Voice Official App: http://bit.ly/TheVoiceOfficialApp » Subscribe for More: http://bit.ly/TheVoiceSub...",https://i.ytimg.com/vi/wJ0fG-6-k_c/default.jpg,The Voice,UCpdK1NLHxEUGXc1gq2NxkTw,701187,14312,463,1316
28,xwTRQxrYGKs,Top 11 Batman Animated Series Episodes - Nostalgia Critic,The Nostalgia Critic looks at the best episodes of one of the greatest TV shows of all time! Batman the Animated Series. Originally aired on 8/16/2011. Get some Nostalgia Critic T-Shirts...,https://i.ytimg.com/vi/xwTRQxrYGKs/default.jpg,Channel Awesome,UCiH828EtgQjTyNIMH6YiOSw,730327,12764,226,1929
29,sRJiOqJxzQw,"The Voice 2017 Addison Agen - Top 11: ""A Case of You""","Addison Agen sings Joni Mitchell's ""A Case of You"" during the live Top 11 performances. » Get The Voice Official App: http://bit.ly/TheVoiceOfficialApp » Subscribe for More: http://bit.ly/TheVoic...",https://i.ytimg.com/vi/sRJiOqJxzQw/default.jpg,The Voice,UCpdK1NLHxEUGXc1gq2NxkTw,1064541,12507,300,1505
30,5_-WNTaSeGc,Top O11CE #15,"Top O11CE, el resumen semanal de tu serie favorita. Las jugadas, las bromas, las pesadillas, las frases y todo eso que pasa alrededor del fútbol. Síguenos en Facebook: https://www.facebook.com/D...",https://i.ytimg.com/vi/5_-WNTaSeGc/default.jpg,Disney XD LA,UCrQXnPc5QSr4Ibu4JhY5KlQ,268189,4567,89,480
31,JJ4Pf_Tzg0Y,Top 11 WORST Avatar Episodes  - Nostalgia Critic,Oh yeah...we're going there! Originally aired on 9/16/2014. See more at our Site: http://channelawesome.com Get some Awesome T-Shirts here - http://shrsl.com/?~96c0 Follow us on Twitter:...,https://i.ytimg.com/vi/JJ4Pf_Tzg0Y/default.jpg,Channel Awesome,UCiH828EtgQjTyNIMH6YiOSw,411619,8852,314,1886
32,tp5ywf61nbk,"The Voice 2017 Keisha Renee - Top 11: ""It Matters to Me""","Keisha Renee sings Faith Hill's ""It Matters to Me"" during the live Top 11 performances. » Get The Voice Official App: http://bit.ly/TheVoiceOfficialApp » Subscribe for More: http://bit.ly/TheVoic...",https://i.ytimg.com/vi/tp5ywf61nbk/default.jpg,The Voice,UCpdK1NLHxEUGXc1gq2NxkTw,212844,4075,141,518
33,YqyYoDa7bfs,"The Voice 2017 Davon Fleming - Top 11: ""I Have Nothing""","Davon Fleming sings Whitney Houston's ""I Have Nothing"" during the live Top 11 performances. » Get The Voice Official App: http://bit.ly/TheVoiceOfficialApp » Subscribe for More: http://bit.ly/The...",https://i.ytimg.com/vi/YqyYoDa7bfs/default.jpg,The Voice,UCpdK1NLHxEUGXc1gq2NxkTw,766370,11547,636,929
34,NmLhb9U6osg,Top 11 Funniest Shyamalan Moments,"With so many to choose, the Nostalgia Critic counts down the funniest moments that were probably never meant to be funny in the first place. Shriners Hospitals for Children - http://bit.ly/1S2pEzl...",https://i.ytimg.com/vi/NmLhb9U6osg/default.jpg,Channel Awesome,UCiH828EtgQjTyNIMH6YiOSw,853630,17220,399,2877
35,LM0nyOupkas,Top 11 Disney Villains - Nostalgia Critic,"Who is the best villain in the Disney Universe? Check out the Nostalgia Critic's the video to find out! Originally aired on December 3, 2008. See more at our Site: http://channelawesome.com...",https://i.ytimg.com/vi/LM0nyOupkas/default.jpg,Channel Awesome,UCiH828EtgQjTyNIMH6YiOSw,349453,5472,81,1364
36,qORj84g9QOI,Top 11 Best Animaniacs Episodes,"Relive your favorite animany, totally insaney moments! Get some Nostalgia Critic T-Shirts here - http://shrsl.com/?~96c0 See more at our Site: http://channelawesome.com Follow us on Twitter:...",https://i.ytimg.com/vi/qORj84g9QOI/default.jpg,Channel Awesome,UCiH828EtgQjTyNIMH6YiOSw,353856,5405,113,672
37,Q7tg6vwXWGo,Top 11 New Halloween Classics - Nostalgia Critic,"We all have our Halloween favorites, but here are the ones deserving of even more attention. Originally aired on October 13th, 2014. See NCs a week early at - http://vessel.com/channelawesome...",https://i.ytimg.com/vi/Q7tg6vwXWGo/default.jpg,Channel Awesome,UCiH828EtgQjTyNIMH6YiOSw,692877,15649,576,2816
38,ww5W2CBqJzk,Top O11CE #11,"Top O11CE, el resumen semanal de tu serie favorita. Las jugadas, las bromas, las pesadillas, las frases y todo eso que pasa alrededor del fútbol. Síguenos en Facebook: https://www.facebook.com/D...",https://i.ytimg.com/vi/ww5W2CBqJzk/default.jpg,Disney XD LA,UCrQXnPc5QSr4Ibu4JhY5KlQ,168394,2557,76,122
39,16cQW4p8PY0,"The Voice 2017 Brooke Simpson - Top 11: ""What About Us""","Brooke Simpson sings P!nk's ""What About Us"" during the live Top 11 performances. » Get The Voice Official App: http://bit.ly/TheVoiceOfficialApp » Subscribe for More: http://bit.ly/TheVoiceSub...",https://i.ytimg.com/vi/16cQW4p8PY0/default.jpg,The Voice,UCpdK1NLHxEUGXc1gq2NxkTw,721409,15210,401,1073
40,JeXIs5LsuLE,Top 11 F Ups - Nostalgia Critic,"We never make any mistakes on Nostalgia Critic.. Ya right! Originally aired on September 2, 2009 See more at our Site: http://channelawesome.com Follow us on Twitter: http://twitter.com/channelaw...",https://i.ytimg.com/vi/JeXIs5LsuLE/default.jpg,Channel Awesome,UCiH828EtgQjTyNIMH6YiOSw,404194,5391,92,1253
41,AnFxe3O3D64,Top 11 Gravity Falls Episodes,"The dark and mysterious show was a hit for many of us, but which ones were the best episodes? Check out Chris and his awesome time lapse videos here - https://www.youtube.com/watch?v=8nKkFgGpd-Y...",https://i.ytimg.com/vi/AnFxe3O3D64/default.jpg,Channel Awesome,UCiH828EtgQjTyNIMH6YiOSw,725275,19421,296,5104
42,X19mgzr0nmg,TOP11 CARROS DOS YOUTUBERS  (2016-2017) || TOP11 ||,"MAIS UM VÍDEO PASSOU, E ESPERO QUE TODOS VCS TENHAM GOSTADO. OBRIGADO POR ASSISTIREM E MANDEM SUGESTÕES DE VÍDEOS NOVOS NO NOSSO FACEBOOK.",https://i.ytimg.com/vi/X19mgzr0nmg/default.jpg,Top11,UCcC24aS7c-vjAe1QNL0d99Q,455005,12662,1632,1838
43,IQg0jT9IWWw,Top 11 TV Show Intros,Did your favorite show make the list? Find out as the Nostalgia Critic counts down his Top 11 Favorite TV Show Intros! See more at our Site: http://channelawesome.com Follow us on Twitter:...,https://i.ytimg.com/vi/IQg0jT9IWWw/default.jpg,Channel Awesome,UCiH828EtgQjTyNIMH6YiOSw,694868,11152,406,4059
44,SmVZlF66g1Q,"The Voice 2017 Janice Freeman - Top 11: ""Shine""","Janice Freeman sings Collective Soul's ""Shine"" during the live Top 11 performances. » Get The Voice Official App: http://bit.ly/TheVoiceOfficialApp » Subscribe for More: http://bit.ly/TheVoiceSub...",https://i.ytimg.com/vi/SmVZlF66g1Q/default.jpg,The Voice,UCpdK1NLHxEUGXc1gq2NxkTw,300957,6132,228,868
45,PUGMTj4uOfc,Top 11 Mindf###s - Nostalgia Critic,"Join the Nostalgia Critic as he counts down the most 'what the hell is going on' moments. Originally aired on February 25th, 2009. Get some Nostalgia Critic T-Shirts here - http://shrsl.com/?~96c0...",https://i.ytimg.com/vi/PUGMTj4uOfc/default.jpg,Channel Awesome,UCiH828EtgQjTyNIMH6YiOSw,336558,6057,86,1146
46,W41gcI3i2DM,"Top 5 Plays of the Night: January 11, 2018","Check out the top 5 plays of the night around the NBA, featuring DeMar DeRozan, Jaylen Brown, Montrezl Harrell, Tyrone Wallace, and Larry Nance Jr.! Top 5 The Top 5 of the night in the NBA,...",https://i.ytimg.com/vi/W41gcI3i2DM/default.jpg,NBA,UCWJ2lWNubArHWmf3FIHbfcQ,203151,3236,57,214
