,id,title,description,thumbnail,channelTitle,channelId,viewCount,likeCount,dislikeCount,commentCount
0,4nStzaQ76wc,"Top 5 Plays of the Night | January 16, 2018","Check out the top 5 plays of the night around the NBA, featuring Anthony Davis, Jayson Tatum, Aaron Gordon, Daniel Theis, and Torrey Craig! The Top 5 of the night in the NBA, tailored down...",https://i.ytimg.com/vi/4nStzaQ76wc/default.jpg,NBA,UCWJ2lWNubArHWmf3FIHbfcQ,96678,1511,1389,255
1,RJoT-pszIxQ,Top 5 Scariest Things Caught on GoPro Camera,"In this top 5 scary videos countdown, we take a look at the scariest things caught on camera by GoPro. Mysterious videos and scary things caught on tape. If you liked this video, also check...",https://i.ytimg.com/vi/RJoT-pszIxQ/default.jpg,Nuke's Top 5,UCBnbnH7DGXT9yBBVFbZeIwQ,522509,6441,578,626
2,XvT9F9z83J4,Top 5 MOST INSANE BANNED Waterslides YOU CAN'T GO ON ANYMORE!,Top 5 MOST INSANE BANNED Waterslides YOU CAN'T GO ON ANYMORE! Top 10 MOST INSANE Waterslides YOU WONT BELIEVE EXIST! CLICK HERE TO WATCH: https://www.youtube.com/watch?v=iJVbjQ4an3c Nexus...,https://i.ytimg.com/vi/XvT9F9z83J4/default.jpg,Top5Central,UCglYq701IltaH0Fk-z3UsSA,28758486,280896,29844,10274
3,PUOjPa65m_U,Top 5 Things Fortnite Does BETTER Than PUBG,"Top 5 Things Fortnite Does BETTER Than PUBG Subscribe: http://goo.gl/Q2kKrD // Have a Top 10 idea? Submit it to us here! http://watchmojo.com/my/suggest.php Fortnite may be the underdog,...",https://i.ytimg.com/vi/PUOjPa65m_U/default.jpg,WatchMojo.com,UCaWd5_7JhbQBe4dknZhsHJg,113877,3556,930,1673
4,TR0aRpk6A0o,"Top 5 KIDS TOYS Gone WRONG! (Bugs In Stuffed Animal, McDonalds Minion)","Top 5 KIDS TOYS Gone WRONG! (Bugs In Stuffed Animal, McDonalds Minion) Last Video: https://www.youtube.com/watch?v=ZDXyBS1G8r0 Follow Me On Twitter: http://www.twitter.com/TrendCrave ORIGINAL...",https://i.ytimg.com/vi/TR0aRpk6A0o/default.jpg,TrendCrave,UCfsV3FguvnnrOijTzcH6heA,189685,8207,153,1628
5,yw8f-wc7Z3Q,Top 5 Strangest Secret Rooms FOUND IN PEOPLES HOUSES!,Top 5 Strangest Secret Rooms FOUND IN PEOPLES HOUSES! Subscribe to never miss a Top 5 here: http://bit.ly/250D2N9 Submit Us Ideas Here https://docs.google.com/forms/d/12Vp3Hb4q6ErHQYsfJtQC8fKg8EBg...,https://i.ytimg.com/vi/yw8f-wc7Z3Q/default.jpg,Top5Central,UCglYq701IltaH0Fk-z3UsSA,2402924,31813,1998,1619
6,68A1G4EOXV8,"Murderous Minds: The Real Psycho, Buffalo Bill & Texas Chainsaw Massacre | Edward Theodore Gein","The names Norman Bates, Buffalo Bill and Leatherface are all heinous, psychotic characters in some of the most horrific horror movies of all time. All despicable human beings that commit monstrous...",https://i.ytimg.com/vi/68A1G4EOXV8/default.jpg,Top5s,UCX51Dixddr5HuwLVBH9ykeQ,162409,9354,79,1360
7,cp0dnHhToYQ,Top 5 CRINGIEST KIDS CAUGHT ON VIDEO!,Top 5 CRINGIEST KIDS CAUGHT ON VIDEO! Subscribe to never miss a Top 5 here: http://bit.ly/250D2N9 Submit Us Ideas Here https://docs.google.com/forms/d/12Vp3Hb4q6ErHQYsfJtQC8fKg8EBgn6cjHnx9snr7p0I...,https://i.ytimg.com/vi/cp0dnHhToYQ/default.jpg,Top5Central,UCglYq701IltaH0Fk-z3UsSA,59178,2629,120,469
8,JsrbTQW9rgc,"Top 5 WORST COACHES Caught On Camera! (Coach Takes Money, Gym Teacher, Students)","Top 5 WORST COACHES Caught On Camera! (Coach Takes Money, Gym Teacher, Students) Last Video: https://www.youtube.com/watch?v=TR0aRpk6A0o Follow Me On Twitter: http://www.twitter.com/TrendCrave...",https://i.ytimg.com/vi/JsrbTQW9rgc/default.jpg,TrendCrave,UCfsV3FguvnnrOijTzcH6heA,133473,5650,96,1089
9,uNzdZbDUUoU,Top 5 Мagicians | Britain's Got Talent 2017,The Sexiest Performances on Got Talent - https://www.youtube.com/watch?v=1JUT5SA0lKM Top Magicians Scenes on Got Talent 2017 - https://www.youtube.com/watch?v=-MBw8nbqiog Top 5 magicians...,https://i.ytimg.com/vi/uNzdZbDUUoU/default.jpg,ShowMe,UCu1wUSjVGL2azTLNN_rqo3Q,32976594,124886,11812,3578
10,webu7DhuEfQ,"Top 5 Youtubers WHO CAUGHT GHOSTS ON VIDEO! (Logan Paul, OmarGoshTV & More)","Top 5 Youtubers WHO CAUGHT GHOSTS ON VIDEO! (Logan Paul, OmarGoshTV & More) Subscribe to never miss a Top 5 here: http://bit.ly/250D2N9 Submit Us Ideas Here https://docs.google.com/forms/d/12Vp3Hb...",https://i.ytimg.com/vi/webu7DhuEfQ/default.jpg,Top5Central,UCglYq701IltaH0Fk-z3UsSA,122706,4449,249,828
11,R47vrRFhfgM,Top 5 Best Indian Time Travel Movies | भारतीय की 5 टाइम ट्रैवल वाली फ़िल्में || Top5 Hindi,Top 5 Best Indian Time Travel Movies... Welcome To Top5 hindi For more interesting updates Please subscribe my channel https://www.youtube.com/channel/UC7vM_F9RA7zldUl16_DGZEQ ▻▻▻ Like...,https://i.ytimg.com/vi/R47vrRFhfgM/default.jpg,Top5 Hindi,UC7vM_F9RA7zldUl16_DGZEQ,10473,653,17,152
12,CE7qNjCvYls,Top 5 Best Thriller Movie | 2017 Best Thriller Movie || Top5 Hindi,"Top 5 Best Thriller Movie , 2017 Best Thriller Movie... Welcome To Top5 hindi For more interesting updates Please subscribe my channel https://www.youtube.com/channel/UC7vM_F9RA7zldUl16_DGZEQ...",https://i.ytimg.com/vi/CE7qNjCvYls/default.jpg,Top5 Hindi,UC7vM_F9RA7zldUl16_DGZEQ,2916,315,9,58
13,NWwYx_WDtZI,বাবা ছেলে | Baba Vs ছেলে | Bangla New Cartoon Jokes Video | Top 5 Jokes | Matha Nosto Jokes | Focus,bangla New Cartoon Jokes. বাবা ছেলে | Baba Vs ছেলে | Bangla New Cartoon Jokes Video | Top 5 Jokes | Matha Nosto Jokes | Focus. Channel Notice | The video is designed...,https://i.ytimg.com/vi/NWwYx_WDtZI/default.jpg,FT Focus Tube,UCTAEzB1PDArn_QtKA1Cz5bg,8823,469,19,38
14,n7V92wR0ZLs,"Top 5 Celebs YOU DIDNT KNOW DATED EACH OTHER! (Jacob Sartorius, Millie Bobby Brown & More)","Top 5 Celebs YOU DIDNT KNOW DATED EACH OTHER! (Jacob Sartorius, Millie Bobby Brown & More) Subscribe to never miss a Top 5 here: http://bit.ly/250D2N9 Submit Us Ideas Here https://docs.google.com/...",https://i.ytimg.com/vi/n7V92wR0ZLs/default.jpg,Top5Central,UCglYq701IltaH0Fk-z3UsSA,51564,2552,217,530
15,HzKRKtfw4Mw,CE VEI ALEGE PENTRU A SUPRAVETUI?!,"Aboneaza-te la Luminescence - https://www.youtube.com/channel/UCp2VeA0KcZuG01sRFzDfuZA Salutare oameni buni,daca v-a placut topul de astazi nu uitati sa dati un like si sa va abonati la canal....",https://i.ytimg.com/vi/HzKRKtfw4Mw/default.jpg,TOP 5,UCgIuAkG5h6egjdDNo-peoXA,79050,2468,253,246
16,CajINDSIJ-Y,5 Early Explorers Who Mysteriously Disappeared During Voyages to Unchartered Lands...,Five early explorers who vanished whilst venturing out into uncharted lands... Thanks to Akira Nora for writing the great and thoroughly researched script. ...,https://i.ytimg.com/vi/CajINDSIJ-Y/default.jpg,Top5s,UCX51Dixddr5HuwLVBH9ykeQ,258951,8411,220,672
17,a9rsKwzHdqI,ரஜினி எதிர்ப்புக்கு TOP 5 காரணம் அதிர்ச்சி ரிப்போர்ட் Rajini Rajinikanth 5 Reasons Political Entry,எங்கள் கூகுல் + லிங்க் (Google +) https://plus.google.com/115342946004295559899 ரஜினி எதிர்ப்புக்கு TOP 5 காரணம்...,https://i.ytimg.com/vi/a9rsKwzHdqI/default.jpg,New Bharathi Studio,UCCLJAvHZaQKIv9lUkZgh8Dg,5950,159,59,34
18,-53hNQFIupk,Top 5 Confidence Killers for Men (and how to overcome them),Learn how to get over physical insecurities. This is how to build confidence and overcome low self esteem. ▽ see below for links & more ▽ HOW TO GET THE BODY GIRLS CRAVE (free program):...,https://i.ytimg.com/vi/-53hNQFIupk/default.jpg,How to Beast,UCtQEjfEFzba37ozoXK40r3w,30878,2942,20,446
19,2BbYwp-i400,"TOP 5 - LIDÉ , KTEŘÍ SE ZASEKLI NA VTIPNÝCH MÍSTECH","Daboval : https://www.youtube.com/channel/UCHKTgY-N2kroEpNNXkjIW7g Dámy a pánové , dneska jsem si pro vás připravil TOP 5 - LIDÉ , KTEŘÍ SE ZASEKLI NA VTIPNÝCH MÍSTECH, takže pokud...",https://i.ytimg.com/vi/2BbYwp-i400/default.jpg,Dave - TOP 5,UCLOaMTxTc9fiaFoja5jbAiQ,531711,8712,809,374
20,Sbq4Fd6x9zs,Top 5 Ghost Sightings CAUGHT ON LIVE TV!,Top 5 Ghost Sightings CAUGHT ON LIVE TV! ENTER TO WIN A $100 AMAZON GIFT CARD BY SUBSCRIBING HERE https://www.youtube.com/watch?v=UZ5gscTzwo4 Caught on live tv playlist : https://www.youtube.com/...,https://i.ytimg.com/vi/Sbq4Fd6x9zs/default.jpg,Top5Central,UCglYq701IltaH0Fk-z3UsSA,4506760,48690,5066,13750
21,iU_o9yI7L98,Gianni Versace Murder: Top 5 Facts You Need to Know,"Top 5 Facts About The Murder Of Gianni Versace // Subscribe: http://www.youtube.com/c/MsMojo?sub_confirmation=1 For this list, we're getting all the details about this 20 year old murder...",https://i.ytimg.com/vi/iU_o9yI7L98/default.jpg,MsMojo,UC3rLoj87ctEHCcS7BuvIzkQ,20197,519,7,28
22,fyAkKn2l_u8,Top 5 banned commercial ads,"Important Notice: If an agency or product owner does not want any publishment, it will withdrawn back. Please send a private youtube message! ○Please Share Your Review And Suggestion...",https://i.ytimg.com/vi/fyAkKn2l_u8/default.jpg,Space Tv,UC28LvdHuPr-0nFztDYqbntA,12459775,18048,4987,1006
23,zkwE-EUuTAA,Top 5 Pasta Recipes,Buy the Tasty Cookbook Today: http://bit.ly/2zVLRyd Get the recipes: https://tasty.co/compilation/top-5-pasta-recipes Check us out on Facebook! - facebook.com/buzzfeedtasty Credits: https://ww...,https://i.ytimg.com/vi/zkwE-EUuTAA/default.jpg,Tasty,UCJFp8uSYCjXOMnkUyb3CQ3Q,265202,11050,172,354
24,e_GipXtxKas,Top 5 Performances from the Divisional Round | GameDay Prime | NFL Highlights,Deion Sanders gives his Top 5 Performances from an insane Divisional Round! Subscribe to NFL Rush! Check out more NFL Channels: https://www.youtube.com/nfl https://www.youtube.com/nflnetwork...,https://i.ytimg.com/vi/e_GipXtxKas/default.jpg,NFL Rush,UC_vl8cSXLBi1tVegCKMRtTw,11278,80,3,22
25,xddzr11WICI,TOP 5 BEST PHONES UNDER ₹15000 BUDGET (2018),Links to buy the Top 5 best phones under ₹15000 budget Honor 7X - http://amzn.to/2DCDWoG Mi A1 - http://fkrt.it/W1kf92NNNN Honor 8 - http://amzn.to/2DneN3E 10.or G - http://amzn.to/2D9ONFk...,https://i.ytimg.com/vi/xddzr11WICI/default.jpg,Trakin Tech,UCEPL07qzVsOcHd3sMUws65g,23387,1836,79,337
26,ulLBKTcwoiY,Jamie's Top 5 Healthy Tips  | Quick & Easy | Jamie Oliver,"It is that time of year when we all get a little conscious of the waistline, and start joining gyms all across the country. These quick and healthy tips are free and take very little commitment...",https://i.ytimg.com/vi/ulLBKTcwoiY/default.jpg,Jamie Oliver,UCpSgg_ECBj25s9moCDfSTsA,119183,3416,134,277
27,vfYUjlUK-vA,"Top 5 Plays of the Night: January 14, 2018","Check out the top 5 plays of the night around the NBA, featuring Giannis Antetokounmpo, Malcolm Brogdon, Kyle O'Quinn, Kristaps Porzingis, Anthony Davis, and Enes Kanter! Top 5 The Top 5 of...",https://i.ytimg.com/vi/vfYUjlUK-vA/default.jpg,NBA,UCWJ2lWNubArHWmf3FIHbfcQ,232565,2424,77,195
28,RWn6AjDc_hI,Angry Acts: Top 5 Angriest Contestants from The X Factor UK,"Hold on to your hats, these guys are not happy! Here are the top 5 angriest contestants from The X Factor UK! X Factor Global brings together the very best acts from around the world, keeping...",https://i.ytimg.com/vi/RWn6AjDc_hI/default.jpg,X Factor Global,UC6my_lD3kBECBifeq0n2mdg,28350486,167940,12683,47932
29,uyvmWBBagbc,Top 5 Animale Care Nu Ar Trebui Să Fie Așa De Mari,Astăzi îți voi arăta 5 animale uriașe pe care probabil nu le-ai mai văzut....Vizionare plăcută! ✦For Business / Partnership: jimmyhex@yahoo.com ✦Urmărește mai multe videoclipuri:...,https://i.ytimg.com/vi/uyvmWBBagbc/default.jpg,Jimmy Hex,UCiPzyQLUu7WKbResmB51KGQ,359824,6178,394,668
30,1AE78enXa-A,"Top 5 Biggest ""NOPE"" Moments! (Scariest Moments Caught On Camera)","Top 5 Biggest ""NOPE"" Moments! (Scariest Moments Caught On Camera) People doing crazy things! Last Video: https://www.youtube.com/watch?v=OYbwQbJmkYA Follow Me On Twitter: http://www.twitter.com/Tre...",https://i.ytimg.com/vi/1AE78enXa-A/default.jpg,TrendCrave,UCfsV3FguvnnrOijTzcH6heA,1094225,20214,1508,4429
31,GHib-W_wmTA,أغرب 5 مقالات في ويكيبيديا,ادخلوا صفحة مقالات غريبة في ويكيبيديا في الرابط أسفل وشاركونا في التعليقات مواضيع غريبة تلاقوها. https://en.wikipedi...,https://i.ytimg.com/vi/GHib-W_wmTA/default.jpg,تلفاز١١,UCu8IbV0yWIiK2QjYFVVD4AA,444361,38797,4622,5678
32,ZhQOjNIqtpw,Top 5 Cops CAUGHT BREAKING THE LAW!,Top 5 Cops CAUGHT BREAKING THE LAW! Top 5 Kids WHO GOT CAUGHT STEALING #3! CLICK HERE TO WATCH: https://www.youtube.com/watch?v=M1EMXEGaPOA Follow us on Twitter to be informed when we post:...,https://i.ytimg.com/vi/ZhQOjNIqtpw/default.jpg,Top5Central,UCglYq701IltaH0Fk-z3UsSA,1072368,16040,2054,878
33,VrP3xZEw9rI,Top 5 Most Controversial Games of 2017,Check out our newest channel MojoPlays! www.youtube.com/mojoplays Top 5 Most Controversial Games of 2017 Subscribe: http://goo.gl/Q2kKrD // Have a Top 10 idea? Submit it to us here! http://watchmo...,https://i.ytimg.com/vi/VrP3xZEw9rI/default.jpg,WatchMojo.com,UCaWd5_7JhbQBe4dknZhsHJg,169907,3917,202,806
34,IWbB0E0o9zY,Top 5 Height Increase Q&Answer | Does Camel Milk Increase Height | Pituitary gland | Dr Shalini,"Height Increase Churan, 45 साल तक अपनी लम्बाई बढ़ाये और आकर्षक दिखें, सभी सवालों के जवाब​,Dr...",https://i.ytimg.com/vi/IWbB0E0o9zY/default.jpg,Recipe With Dr Shalini,UCrPdi5n5TsvyetOd5pAUH9w,21775,2031,40,795
35,djVDpDRIyR8,Top 5 Loài Thủy Quái Đáng Sợ Nhất Thời Hiện Đại!,Tốp 5 Lạ Kỳ: Top 5 Loài Thủy Quái Đáng Sợ Nhất Thời Hiện Đại: https://youtu.be/djVDpDRIyR8 Full danh sách video Sự Thật Về Các Quốc Gia: goo.gl/BzePi1 Con...,https://i.ytimg.com/vi/djVDpDRIyR8/default.jpg,HAYTV Channel,UCf3bW2-ucrqjK5hOrlDogGQ,2495769,23206,1138,2073
36,pHZTeb0kMCU,TOP 5 - Odporných Sladkostí,"Patreon pro životní funkce: https://www.patreon.com/user?u=3618596 (Patreon je něco, jako subscribe na twitchi, znamená to, že můžete každý měsíc přispívat vámi určenou částkou,...",https://i.ytimg.com/vi/pHZTeb0kMCU/default.jpg,Pixelorez - TOP 5,UC1tSSv7uXTLvP3lRup3gpFQ,216301,9040,262,726
37,FTD9aA4S5BY,Top 5 SHOCKING MAGICIAN America and Britain's Got Talent 2016,CLICK HERE to Learn How To Sing Tips To Improve Your Singing Voice ▻ http://MusicTalentNow.com/Learn-To-Sing ◅ ♥ Please Follow Me On Twitter ♥ http://bit.ly/Twitter_MusicTalentNow...,https://i.ytimg.com/vi/FTD9aA4S5BY/default.jpg,MusicTalentNow,UCDnEa2HC2eeT-cN3pAKnNTw,46108235,149880,11789,4429
38,XWoaKy-8Dt0,Top 5 Scariest GHOST Sightings Caught On LIVE TV! (Creepy Ghosts),Top 5 Scariest GHOST Sightings Caught On LIVE TV! (Creepy Ghosts) Last Video: https://www.youtube.com/watch?v=lZlFz89LaH8 Follow Me On Twitter: http://www.twitter.com/TrendCrave ORIGINAL...,https://i.ytimg.com/vi/XWoaKy-8Dt0/default.jpg,TrendCrave,UCfsV3FguvnnrOijTzcH6heA,700897,17349,1169,4463
39,9xVclxa6FP8,Top 5 Songs You Didn't Know Were Written By Meghan Trainor,Top 5 Songs You Didn't Know Were Written By Meghan Trainor // Subscribe: http://www.youtube.com/c/MsMojo?sub_confirmation=1 Did you know that Meghan Trainor wrote these songs? “Can't Blame...,https://i.ytimg.com/vi/9xVclxa6FP8/default.jpg,MsMojo,UC3rLoj87ctEHCcS7BuvIzkQ,52202,1070,36,99
40,xAFNQoXNecw,"5 Creepiest Encounters That Were Posted On Reddit, You Need To Hear...",Previous Videos: https://youtu.be/NMcB8ZXAhEk https://youtu.be/HmSl4g55PYk Narrated By: Ty Notts Music: Co.Ag ___ FB: https://www.facebook.com/TheRealTop5U/ TW: https://twitter.com/top5unknowns...,https://i.ytimg.com/vi/xAFNQoXNecw/default.jpg,Top 5 Unknowns,UCHgI_MItRWEKLX7lKz7Xn0g,76266,2124,114,288
41,TfQNADWVPxI,"Top 5 Plays of the Night: January 13, 2018","Check out the top 5 plays of the night around the NBA, featuring Kris Dunn, Dwight Howard, Lauri Markkanen, Jakob Poeltl, and DeMar DeRozan! The Top 5 of the night in the NBA, tailored down...",https://i.ytimg.com/vi/TfQNADWVPxI/default.jpg,NBA,UCWJ2lWNubArHWmf3FIHbfcQ,243623,2572,468,266
42,1KSr1TN-Pkc,"Top 5 Youtubers WHO GOT ROASTED ON LIVE TV! (Logan Paul, KSI & More)","Top 5 Youtubers WHO GOT ROASTED ON LIVE TV! (Logan Paul, KSI & More) Subscribe to never miss a Top 5 here: http://bit.ly/250D2N9 Submit Us Ideas Here https://docs.google.com/forms/d/12Vp3Hb4q6ErHQ...",https://i.ytimg.com/vi/1KSr1TN-Pkc/default.jpg,Top5Central,UCglYq701IltaH0Fk-z3UsSA,532815,9943,951,1722
43,lvdjCvogA9o,அழிவிலிருந்து மீண்டுவந்த 5 உயிரினங்கள் | Top 5 Extinct Animals that may be still Alive | TAMIL ONE,"Top 5 Extinct Animals that may be still Alive, #அழிவிலிருந்து மீண்டுவந்த 5 அதிசய உயிரினங்கள். Music Courtesy :...",https://i.ytimg.com/vi/lvdjCvogA9o/default.jpg,TAMIL ONE,UCIC9Q3_2XgeVarmO7oNY_Kw,248,28,3,2
44,qkrxV8g0H6Q,TOP 5 Freakiest Bodybuilders Ever In Bodybuilding History,Those 5 bodybuilders are the most freaky of all ever in the bodybuilding history. Who is the most freaky? Comment down below. Subscribe for more videos. Soundtracks: SKYL1NK - The Wizard...,https://i.ytimg.com/vi/qkrxV8g0H6Q/default.jpg,allan97,UC9vLfQrLGLwAfsnE-A0bWvg,40881269,52133,19689,5136
45,VSyUO6ynV_8,Top 5 | Stvorenja Koja Su Snimljena KAMEROM,SUBSCRIBE : https://goo.gl/X2IaoR NOVI KLIPOVI SVAKE SREDE I SUBOTE Top 5 | Ljudi sa SUPER MOĆIMA snimljeni KAMEROM https://goo.gl/sjYMUE ▻ Top 5 | Urbane...,https://i.ytimg.com/vi/VSyUO6ynV_8/default.jpg,Top 5 Srbija,UCbBSw-pefE1-lJCpo0njB4g,841051,16508,1177,788
